Playlist ID,Nombre Playlist,Descripción,Número de canciones,Url de Spotify
2GI8SYQS9QiM32dHzyhvfm,SERTANEJO 2024 🚀 TOP 100 MAIS TOCADAS,Ouça aqui os maiores Hits e Lançamentos do Sertanejo 2023&#x2F;2024!  Clique no 💚 e Siga a Playlist! Foto: Henrique e Juliano,138,https://open.spotify.com/playlist/2GI8SYQS9QiM32dHzyhvfm
5w4r09iWaUJuSiLBvMISrC,R&B TOP HITS, Fresh and trending R&amp;B tracks you can&#x27;t miss.,77,https://open.spotify.com/playlist/5w4r09iWaUJuSiLBvMISrC
0Xmx2woL6vHNHufCzb9fY2,Dave Matthews Band Live Top Versions,The top live versions of every DMB song.,171,https://open.spotify.com/playlist/0Xmx2woL6vHNHufCzb9fY2
75GeX247deNdTX7zdyZDnU,Top 100 Nigeria,"Nigeria Top 100: The most played songs in Nigeria, updated daily. (Fi Kan We Kan - Bnxn, Rema · MMS - Asake, Wizkid · Alone - Remix - FOLA, Bnxn · Awolowo - Fido · JUJU (feat. Shallipopi) - E Smur Lee, ODUMODUBLVCK, Shallipopi · Remember - Asake · Ac",100,https://open.spotify.com/playlist/75GeX247deNdTX7zdyZDnU
7fHwuxUGmEBQHjajMUXJXS,YOUNG THUG HARDEST TRACKS 🐍🔥 BEST OF THUGGER,YOUNG THUG'S HARDEST SONGS - Best of Thugger - Young Thug Songs Playlist - Young Thug's Top Songs -Best of all time - All time Favorites - Favourites - As Melhores - Classics - Hits Business is Business - Slime Season - Slime Language  - Unreleased,59,https://open.spotify.com/playlist/7fHwuxUGmEBQHjajMUXJXS
4ZB8LNvjTqxyUZPzHyYYJq,Remixes 2024 🔥 Best Popular Songs Remixed 🔥 Best Remixes & EDM Hits 2024,"Remixes of popular songs (the latest worldwide Top Hits 2024 &amp; more). The best songs, DJ Music, the best artists &amp; the best DJ's! These Words - Badger, Makeba Remix, Goosebumps Remix, It's Friday day, Roses Remix... all new, all remixed 2023! Sped Up edits and Djs Remixes! ",268,https://open.spotify.com/playlist/4ZB8LNvjTqxyUZPzHyYYJq
0WLp26evdG47aSUPnJGEjB,Kendrick Lamar the GOAT ,top of the morning ! scottinethia@gmail.com !,123,https://open.spotify.com/playlist/0WLp26evdG47aSUPnJGEjB
1QbfTt9cPFAmhfVxTDZ0rT,2015 nostalgia,"Life hit different when insta had white borders - Favorite top hits of 2015, pop, hip-hop, R&amp;B, EDM, alternative, radio hits - The Chainsmokers, Vance Joy, WALK THE MOON, Ed Sheeran, Twenty One Pilots, Kendrick Lamar, Sia, Fall Out Boy, 5 Seconds of Summer, One Direction",48,https://open.spotify.com/playlist/1QbfTt9cPFAmhfVxTDZ0rT
3sOfntnEq5IcpG6xE7C1dD,Top EDM DJ's,Music that will be inspirational as a DJ my self ===ixahoney@gmail.com,75,https://open.spotify.com/playlist/3sOfntnEq5IcpG6xE7C1dD
2raFkGXho14vBw0FQTjlMD,Top Hits of 2015,,101,https://open.spotify.com/playlist/2raFkGXho14vBw0FQTjlMD
06SNkILardiCYCc1xuVElK,Yacht Rock - 100 Best Ever - Top Yacht Rock Songs,Top 100 Yacht Rock Tunes Of All Time,114,https://open.spotify.com/playlist/06SNkILardiCYCc1xuVElK
3uEIq4MtL84iIVDoZIFVBh,Top Hits of 2013,,99,https://open.spotify.com/playlist/3uEIq4MtL84iIVDoZIFVBh
3hosEn7w7WvAaakF12DSwE,Genesis Greatest Hits,"En 1969 Peter Grabiel, Tony Banks, Michael Rutherford, Anthony Phillips empezaron un proyecto musical llamado Genesis. Top 40 Songs #PaLosViejos",45,https://open.spotify.com/playlist/3hosEn7w7WvAaakF12DSwE
3NJmFR02JQRYIB7COYckSR,Top 50: Puerto Rico,Top 50: Puerto Rico,230,https://open.spotify.com/playlist/3NJmFR02JQRYIB7COYckSR
53kkbqjHRI17iLqngGLMUg,Top Spanish Party Hits,,112,https://open.spotify.com/playlist/53kkbqjHRI17iLqngGLMUg
37i9dQZF1DX2tJDnqbLeco,TOP 아티스트 2023,2023년 대한민국을 빛낸 아티스트들을 만나보세요! (커버: 지민),50,https://open.spotify.com/playlist/37i9dQZF1DX2tJDnqbLeco
7zjBdZjF4fw4Ay4Bq2xUCf,Top One Hit Wonders of all time,"This is a compilation of some of the greatest one hit wonders from 60&#x27;s, 70&#x27;s, 80&#x27;s, 90&#x27;s and 00&#x27;s. There are a few two hit wonders artists too.",269,https://open.spotify.com/playlist/7zjBdZjF4fw4Ay4Bq2xUCf
37i9dQZEVXbKAbrMR8uuf7,Top 50 - Dominican Republic,Your daily update of the most played tracks right now - Dominican Republic.,50,https://open.spotify.com/playlist/37i9dQZEVXbKAbrMR8uuf7
39FD21WmUnklfXGYb8CIdX,Top Tier Dance,Time to rage! ⚡🔥 Top tier EDM bangers to get the party lit. Send your best track here Feel free to submit entry at speculator.seth.ss@gmail.com,73,https://open.spotify.com/playlist/39FD21WmUnklfXGYb8CIdX
1phQWqdkJCBZgunDBJDPjD,Top Jazz Playlist '24,Fast-paced bebop tunes with complex rhythms and improvisations that’ll keep your toes tapping.,72,https://open.spotify.com/playlist/1phQWqdkJCBZgunDBJDPjD
74m0CRHQqXlKrxNofnf8w6,Top 100 Reggae Highs,Lush island reggae with elements of chillwave and tropical house for an elevated musical escape.,70,https://open.spotify.com/playlist/74m0CRHQqXlKrxNofnf8w6
0AibMZNn7vaWSbC21GUEL1,To the top,,284,https://open.spotify.com/playlist/0AibMZNn7vaWSbC21GUEL1
0ePPW2ZeGo30MjFG6itcPG,Clean Tik Tok Hits 2024✨✨,Best Clean Pop songs 2024 viral on Tiktok 2023 &amp; 2024 - Top Clean Pop Hits 2024 &amp; more non explicits songs trending on Tik Tok 2024.  Hits Clean Pop Songs 2024  ✨✨,283,https://open.spotify.com/playlist/0ePPW2ZeGo30MjFG6itcPG
3BOxfexQyBa1tsEZ1tJFVQ,Lofi Hip Hop 2024 (Top 100),,379,https://open.spotify.com/playlist/3BOxfexQyBa1tsEZ1tJFVQ
37i9dQZF1DXbc4fNXqfjT8,Top Tracks 2023 Indonesia,Deretan lagu dalam negeri dan mancanegara yang paling banyak diputar sepanjang 2023. Cover: Anggi Marito,50,https://open.spotify.com/playlist/37i9dQZF1DXbc4fNXqfjT8
7GsKacogsnMS0ezHbr74IT,"CUMBIAS TOPPAZ, PEGASSO, MIER,  GRUPO BRYNDIS Y MAS",,261,https://open.spotify.com/playlist/7GsKacogsnMS0ezHbr74IT
1Dgqqzf5nGoFidMEm8bYgy,Top Chart Hits,Ease into your day with top music hits in the billboard and New Release | lanastyles989@gmail.com,65,https://open.spotify.com/playlist/1Dgqqzf5nGoFidMEm8bYgy
3dwOfRKHlJYIBqRB3Tcbkx,Todays Country Hits 2024 - Top Country Hits 2024,"New Country Music, Best Country Songs, Latest Country Releases, Top Country Tracks, Fresh Country Hits, Country Music Playlist.",182,https://open.spotify.com/playlist/3dwOfRKHlJYIBqRB3Tcbkx
3sdlWZEB3auJENa9aDYO3W,Top 100 USA chart,Experience the Top Hits in the USA | New Songs release every week -send new release to troyeillish@gmail.com,64,https://open.spotify.com/playlist/3sdlWZEB3auJENa9aDYO3W
4YYOnVhrLA4QLJsk4HbIxl,John Mayer - Top Tracks,"Listen to new track Last Train Home, plus all the hits including New Light, Gravity, Who Says, Waiting On the World to Change &amp; more! Follow for new music updates. Catch John on tour this summer with Dead &amp; Company: <a href=""http://johmayer.com"">johnmayer.com</a>",49,https://open.spotify.com/playlist/4YYOnVhrLA4QLJsk4HbIxl
37i9dQZF1DX5rOEFf3Iycd,All Out 80s Hindi,"Reigning kings & queens to future superstars, 80s Bollywood had it all.",100,https://open.spotify.com/playlist/37i9dQZF1DX5rOEFf3Iycd
37i9dQZF1DXdgckExLlG1g,Most Favored,"The top Christian songs worldwide!  Cover: <a href=""spotify:artist:6pRi6EIPXz4QJEOEsBaA0m"">Chris Tomlin</a> ",50,https://open.spotify.com/playlist/37i9dQZF1DXdgckExLlG1g
4Ymf8eaPQGT7HMTymoX82f,AMAPIANO 2024🇿🇦🇿🇦 | SOUTH AFRICA (SA)🇿🇦🇿🇦| AMAPIANO TIKTOK HITS | AFROBEATS |AMAPIANO GROOVE ,"Explore the beautiful sounds straight from the streets of South African, Top Amapiano Tiktok hits mixed with Amapiano from other parts of Africa. Press play and let your feet be the judge. These hits will keep you dancing for hours!! Music from all over Africa!!",60,https://open.spotify.com/playlist/4Ymf8eaPQGT7HMTymoX82f
22HQX0p10rSJFXjguPwlOO,Ariana Grande Greatest Hits,"Top best songs from Ariana Grande - Ariana Grande Best Songs - Ariana Grande Top Hits - we can&#x27;t be friends - 7 rings - eternal sunshine - god is a woman - thank u, next - Ariana Grande Greatest Hits - Ariana Grande Playlist",76,https://open.spotify.com/playlist/22HQX0p10rSJFXjguPwlOO
6SqXHSOaKK7KMdafiJne2e,Top Songs 2024 🔥 BEST HITS,All the top new hits!,48,https://open.spotify.com/playlist/6SqXHSOaKK7KMdafiJne2e
6SX9mvpZKyZqxy6KQ6mA5a,Post Malone New Releases 🔥,post malone new releases  i had some help 2024 all top songs popular country charts top 50 pop viral 100 hot trending austin f-1 trillion album,64,https://open.spotify.com/playlist/6SX9mvpZKyZqxy6KQ6mA5a
39UXpFDUxhkvdHJmWtdXzt,Top EDC Bangers,All the sickest tracks to keep you hyped at EDC! 🔥 Direct your submission to dudiedu.dud@gmail.com,58,https://open.spotify.com/playlist/39UXpFDUxhkvdHJmWtdXzt
37i9dQZF1DWTWdbR13PQYH,Top Hits of 2004,Rewind and rediscover big songs of 2004. Cover: Maroon 5,100,https://open.spotify.com/playlist/37i9dQZF1DWTWdbR13PQYH
4HqSFgPXT0X0kIuLrAfF7o,Top Hits of 2011,,144,https://open.spotify.com/playlist/4HqSFgPXT0X0kIuLrAfF7o
7Irt9bkccUZCj7Nq1klW5v,Love Songs 70s 80s 90s Mix | Romantic Music |  Românticas Internacionais | Top Músicas de Amor,"As Top Músicas Internacionais Românticas dos anos 70,80,90 para relembrar o passado e curtir com seu amor! (Capa Foto Grátis:Pixabay) #LoveSongs #70s #80s #90s #LionelRichie #TopMúsicasdeAmor #RomânticasInternacionais #Romantic #ThePolice #BryanAdams #EltonJohn #AirSupply #Chicago #ElvisPresley",102,https://open.spotify.com/playlist/7Irt9bkccUZCj7Nq1klW5v
6sLKqrUF3TEfcMkcS6P3gu,2010s Throwbacks (Top 100 Hits),Best Hits from 2010 to 2015 with a few oldies and more recent picks.,116,https://open.spotify.com/playlist/6sLKqrUF3TEfcMkcS6P3gu
7uT6y18BRnIeNyyVCptM4B,Best Christian Hip Hop 2024,"The Top 40 in Christian Rap, updated weekly! Cover: Zauntee",42,https://open.spotify.com/playlist/7uT6y18BRnIeNyyVCptM4B
37i9dQZF1DXaW8fzPh9b08,Top Hits of 2003,Rewind and rediscover big songs of 2003. Cover: 50 Cent,100,https://open.spotify.com/playlist/37i9dQZF1DXaW8fzPh9b08
7HJRsZmDIb6DLaV7MFihQ5,Today's Top Hits CLEAN,"The CLEAN version of Today&#x27;s Top Hits. Updated Nov 1, 2024. Follow @Top50Clean on Instagram. Find more playlists at top50clean.com. Featuring the latest from The Band That Saved The World. Note: may be fewer songs than original due to clean versions not being available.",50,https://open.spotify.com/playlist/7HJRsZmDIb6DLaV7MFihQ5
0UqA3MJ7l2dbo9SAwddYV8,Top Hits of 2007,,181,https://open.spotify.com/playlist/0UqA3MJ7l2dbo9SAwddYV8
555fxD1RXv8rOYcmOihJ69,rap GOD,"packed with sick flows, killer verses, and the best beats from rap’s top legends and fresh new talent",74,https://open.spotify.com/playlist/555fxD1RXv8rOYcmOihJ69
6piKpz0MrRCcKpTaqlzgRi,VIRAL USA 2024,Updated ! Top VIRAL US - US Charts - USA Top VIRAL - United States Top VIRAL - US Radio VIRAL - USA Radio VIRAL - United States Radio VIRAL ...,83,https://open.spotify.com/playlist/6piKpz0MrRCcKpTaqlzgRi
08xC0vF4uIajvNxyWTZ7ek,StandUp Comedy MVP 2024 VOL.1,"A collection of raunchy, topical, and crowd working content by a variety of comedians. 1960-2024 NSFW",9983,https://open.spotify.com/playlist/08xC0vF4uIajvNxyWTZ7ek
37i9dQZF1DXdGUQjVlqY2Q,最Hit粵語榜,熱門廣東流行音樂排行榜歌曲。Top Cantopop Hits of the week! Cover: 林家謙,50,https://open.spotify.com/playlist/37i9dQZF1DXdGUQjVlqY2Q
3UxGct3HaX1ykHrU5xTzDx,Country over hiphop,The top modern country music that make you forget of that bullshit rap Enter at samuca3231q@gmail.com,72,https://open.spotify.com/playlist/3UxGct3HaX1ykHrU5xTzDx
37i9dQZEVXbKuaTI1Z1Afx,Viral 50 - USA,Your daily update of the most viral tracks right now - USA.,50,https://open.spotify.com/playlist/37i9dQZEVXbKuaTI1Z1Afx
37i9dQZF1DWVRSukIED0e9,Top Hits of 2019,Rewind and rediscover big songs of 2019. Cover: Ariana Grande,100,https://open.spotify.com/playlist/37i9dQZF1DWVRSukIED0e9
6J4xA2TNtn1SIUmHeGNnBb,Santa Fe Klan Éxitos 2024 🔪,Lo mejor de Santa Fe Klan hits top🔪 Santa fe klan🔪 Puro Santa Fe klan 🔪,37,https://open.spotify.com/playlist/6J4xA2TNtn1SIUmHeGNnBb
4Xwv0G0uD9WK6YCyq7MKw7,Las 100 Mejores Canciones Pop en Ingles,"If you enjoyed this playlist, you can also find us with: top 100 musica en ingles - mashup musica en ingles - canciones pop en ingles - top musica en ingles - musica pop ingles - canciones pop en ingles playlist - playlist de musica pop en ingles - musica pop en ingles mix - mix pop en ingles",100,https://open.spotify.com/playlist/4Xwv0G0uD9WK6YCyq7MKw7
2vHE1sFqVHx3lYwBFyFZcY,Top EDM Hits of the 2010s,The best electronic music released in the 2010s. Check out my other playlists! Suggestions? DM on IG :),1092,https://open.spotify.com/playlist/2vHE1sFqVHx3lYwBFyFZcY
34mHQvF8O64AtciV25thvV,Trending In Rap,Top rap tracks updated every week with new artists || dan645907@gmail.com,67,https://open.spotify.com/playlist/34mHQvF8O64AtciV25thvV
7GElqlkPW3tH4VxsEgdDEy,Kpop Top Charts,"Catch the latest Kpop Hits, awards and more. Add your best song here ashleycataleyaang58642@gmail.com",54,https://open.spotify.com/playlist/7GElqlkPW3tH4VxsEgdDEy
0Euz26wsA7srnxNiL7x92U,Top 100 Gospel - 2024,O seu top diário com as 100 melhores canções gospel e louvores da atualidade 2024. Capa: Isadora Pompeo com “Ovelhinha”,108,https://open.spotify.com/playlist/0Euz26wsA7srnxNiL7x92U
1l6FVZYUqKH7OUXsKRVZBN,⚡️ BEST ANIME SONGS 2024 ⚡️,"WEEKLY UPDATES 🎧 Top Anime Song, OST, Opening, Ending, BGM, OP, ED with JJK, One Piece, MHA, Demon Slayer, SNK, Naruto, Chainsaw Man, YOASOBI, DBZ, HXH, Jojo, Tokyo Ghoul, Attack on Titan, My Hero Academia",167,https://open.spotify.com/playlist/1l6FVZYUqKH7OUXsKRVZBN
1koyIdOfW4lxtr46r7Dwa8,Top 100 most recognisable songs of all time,"And yes, Bohemian Rhapsody is first 😂",100,https://open.spotify.com/playlist/1koyIdOfW4lxtr46r7Dwa8
7aXgpi0RpkndHWl4wYYAWc,Latin hits 2024,"Lo + Nuevo del LAT, y los éxitos más top de la música latina 2024 y últimos años en esta playlist.  Latino 2020s! send your latin songs at xzitmx60@gmail.com",67,https://open.spotify.com/playlist/7aXgpi0RpkndHWl4wYYAWc
4YzpPDk8r9krimzq8D2VrY,Sade: Top tracks,"The ultimate SADE playlist, featuring By Your Side, No Ordinary Love, Cherish the Day, Smooth Operator, The Big Unknown, Soldier of Love, Sweetest Taboo, Your Love Is King, Is It a Crime and many more....",63,https://open.spotify.com/playlist/4YzpPDk8r9krimzq8D2VrY
2ZB0Yz2GlWvYnfjv7SKzlD,Spinnin',Best dance remixes  - top EDM hits 2024 - techno beats for clubs - electronic dance music   ~ yutzilpalma@gmail.com,71,https://open.spotify.com/playlist/2ZB0Yz2GlWvYnfjv7SKzlD
37i9dQZEVXbIPWwFssbupI,Top 50 - France,Your daily update of the most played tracks right now - France.,50,https://open.spotify.com/playlist/37i9dQZEVXbIPWwFssbupI
37i9dQZF1DX688wU47emR9,Hot Hits Malayalam,"Catch the hottest Malayalam tracks here!
Cover:  ARM",50,https://open.spotify.com/playlist/37i9dQZF1DX688wU47emR9
5tSbO6M5AT7r91ytDd4nNP,R&B Hits 2024,hot best RNB r&amp;b songs of 2023 most popular trending today chill rnb music viral top 100 hottest pop rap mix latest neo soul contemporary sensual sensual rnb sexplaylist sex sexx r&amp;amp;bplaylist rnb playlist rnbvibes rnb vibes,375,https://open.spotify.com/playlist/5tSbO6M5AT7r91ytDd4nNP
37i9dQZEVXbIQnj7RRhdSX,Top 50 - Italy,Your daily update of the most played tracks right now - Italy.,50,https://open.spotify.com/playlist/37i9dQZEVXbIQnj7RRhdSX
6hOB3I5XWVTvQVrKgTwvxH,Most Popular Country Songs Of All Time - Top 100 Greatest Country Hits (Best Country Music Ever),"You can find our playlist through YouTube and Google searches using these words too: country music, top country songs, best country songs, greatest country hits, country favorites of all time, classic country music, country music playlists, country music videos, country songs all time favorites, best country music of all time, best country music ever, country music everyone need, the best country hits, the best country hits of all time.",100,https://open.spotify.com/playlist/6hOB3I5XWVTvQVrKgTwvxH
4hK25gScGegOxXTV6u5E21,Ed Sheeran Best Hits,Ed Sheeran best hits - Ed Sheeran best songs - Ed Sheeran top hits - Ed Sheeran all songs - Shape of you - Perfect - Eyes Closed - Ed Sheeran Tour Setlist,54,https://open.spotify.com/playlist/4hK25gScGegOxXTV6u5E21
2Z2fF1Ieo2yJWxPVXSl8JC,Late Night Hip-Hop,Updated regularly with my top late night drive music picks JDM Lexus LFA and Music to drive and listen to (through the late night) ,69,https://open.spotify.com/playlist/2Z2fF1Ieo2yJWxPVXSl8JC
5SosJI6dfij13xInFDi3PP,Neil Diamond - His 20 Greatest Hits,"&quot;Cracklin&#x27; Rosie&quot; is here, along with Diamond&#x27;s other chart-topper of the period, &quot;Song Sung Blue,&quot; and the Top Ten hits &quot;Sweet Caroline&quot; and &quot;Holly Holy.&quot;",20,https://open.spotify.com/playlist/5SosJI6dfij13xInFDi3PP
5iYeSAR4fs2XXnSzjowQ9l,you're in an edit (tiktok edits 2024),best tik tok edits audios right now - top edit songs 2024 + 2023 hits. POV : you are in an edit. tik tok trends 2023 &amp; 2024 updated weekly. New sped ups + tiktok edit songs! Updated : April 2024 - best 2023 edits,249,https://open.spotify.com/playlist/5iYeSAR4fs2XXnSzjowQ9l
6kpdPhPsHrJXlYXsXMXQ40,Top 1000 - Best Hits ever! 90s 80s 00s 90 80 2000,"Playlist Created with https:&#x2F;&#x2F;www.tunemymusic.com?source=plcreateds that lets you transfer your playlist to Spotify from any music platform such as YouTube, Deezer etc",649,https://open.spotify.com/playlist/6kpdPhPsHrJXlYXsXMXQ40
4NHM3HqdFHRyQifPo9GZAB,Sad Songs For The Boys 😢💔 2023 - Top saddest tracks to cry to,saddest songs for the boys 2023 - depressing music - depressed - crying - to cry to - top sad song - sad vibes - sad emo rap (Submissions: ko-fi.com/esydia) curated by @gho_,109,https://open.spotify.com/playlist/4NHM3HqdFHRyQifPo9GZAB
0CMN4KfBhEjXpTeKMOQxMR,Top Hits of Early 2000s,rnb 2000s &#x2F; 2000s party hits &#x2F; Throwback 2000s-2010s Hip Hop &#x2F; clubbing like it&#x27;s the 2000&#x27;s &#x2F; Hit anni 2000&#x2F;2010 &#x2F; Músicas internacionais - anos 2000 &#x2F; 2000s r&amp;b  &#x2F; hip hop anos 2000 &#x2F; 90’s &amp; 2000’s Hip Hop Bangers &#x2F; Los 2000s (lo mejor de MTV 2000-2006) &#x2F; HIP HOP ANOS 90 E 2000 ,127,https://open.spotify.com/playlist/0CMN4KfBhEjXpTeKMOQxMR
7nnKsGPB7jcl2aR2ILOi16,Top 50 Mother Son Dance,Top 50 Mother Son Dance Songs For Weddings brought to you by ADM Productions. www.admdj.com,50,https://open.spotify.com/playlist/7nnKsGPB7jcl2aR2ILOi16
0Zarq4BVkFkZOWkmqsfrjA,Drum and Bass Top 100,"A selection of our current favourite drum &amp; bass tracks, perfect for running, gaming and raving. Featuring Grafix, goddard., Emily Makis, Delta Heavy, Koven and many more.",100,https://open.spotify.com/playlist/0Zarq4BVkFkZOWkmqsfrjA
5jsaNeWFODoZocaxTkmihr,Fleetwood Mac: Top Tracks,Listen to all of Fleetwood Mac's Hits &amp; More,51,https://open.spotify.com/playlist/5jsaNeWFODoZocaxTkmihr
1VfwAMYqbxxMY0TvJFvVgj,TOP 50 MEJORES CANCIONES CATÓLICAS,MÚSICA JUVENIL 100% CATÓLICA,50,https://open.spotify.com/playlist/1VfwAMYqbxxMY0TvJFvVgj
6TMuXkxElkRUIEFmxyrCcq,80s Music Hits - Best Songs from the 80's Playlist,Find our playlist with these keywords: 80s songs playlist - top 80s music hits - popular 1980s music - best songs from the 80&#x27;s - songs from the 1980s - famous 1980s songs - 80s hits mix playlist - 80s music - best 80&#x27;s songs compilation - songs from the 1980s - 1980 best music hits - 80s songs mix,150,https://open.spotify.com/playlist/6TMuXkxElkRUIEFmxyrCcq
2SVGmmNcsaOKwRKiQeJ7DU,R&B Vibe Check,Stay on top of the latest R&amp;B trends with a playlist full of the freshest tracks and hottest artists. Perfect for keeping your vibe in check with today’s best sounds.,59,https://open.spotify.com/playlist/2SVGmmNcsaOKwRKiQeJ7DU
4GSf50Z9j4p9BAyqvHUXcP,Sonic x Shadow Generations OST Soundtrack,"Sonic &amp; Shadow The Hedgehog OST playlist. Sonic x Shadow Generations best songs. Top mix of Sonic Adventure 1&#x2F;2, Generations and more.",101,https://open.spotify.com/playlist/4GSf50Z9j4p9BAyqvHUXcP
62heqn9RMgJxwwbTqBEm6H,Party Jams,"Dance to the rhythm of chart-topping pop party anthems, featuring the biggest names in the music industry.",49,https://open.spotify.com/playlist/62heqn9RMgJxwwbTqBEm6H
6ZUlHpi5D6egacMR89kW05,Modern Country Mavericks,"A collection of contemporary country hits, showcasing the latest chart-toppers and the rising stars of the genre.",64,https://open.spotify.com/playlist/6ZUlHpi5D6egacMR89kW05
4oaHSk8Id7K9B64yxwDs3A,Los rancheritos de topo chico exitos,,15,https://open.spotify.com/playlist/4oaHSk8Id7K9B64yxwDs3A
37i9dQZEVXbKUoIkUXteF6,Top Songs - Mexico,Your weekly update of the most played tracks right now - Mexico.,50,https://open.spotify.com/playlist/37i9dQZEVXbKUoIkUXteF6
0MMyCic43JQurCgLV1X41Y,TODAY'S TOP COUNTRY HITS,"Country's top hits now!  Follow <a href=""https://open.spotify.com/user/themusicden?si=4df77df1e0994287"">Here</a> for other lists from The Music Den. On The Cover:  Dylan Scott",55,https://open.spotify.com/playlist/0MMyCic43JQurCgLV1X41Y
3lIV45agMMlSjD2HMblvMm,The Top Broadway Musical Hits Over Time,"Hits over the years of top songs from Broadway musicals as well as favorite movie songs.  This playlist evolves over time, and if you have any suggestions then email me: harinder66 at hotmail. ",267,https://open.spotify.com/playlist/3lIV45agMMlSjD2HMblvMm
7w4hFg3PuhhSUH42ypv2eS,Top 18 Alternative Rock: 02 NOV 2024,Everyone&#x27;s favorite weekly countdown of the most requested songs on satellite radio ch. 36,18,https://open.spotify.com/playlist/7w4hFg3PuhhSUH42ypv2eS
5l771HfZDqlBsDFQzO0431,Top Hits of 2018,Rewind and rediscover big songs of 2018. Cover: Drake,100,https://open.spotify.com/playlist/5l771HfZDqlBsDFQzO0431
0mqADZe33cZYeyydQK7nIt,chappell + olivia + sabrina + taylor + gracie 💞🏹🎉,top 5 💞💞💞,143,https://open.spotify.com/playlist/0mqADZe33cZYeyydQK7nIt
7CmreRETnY6t2MdHrIiaIA,Top 100 Doo Wop Hits 1953-1964,"This list covers the “doo wop era” of 1953 to 1959, follows immediately by the “doo wop revival” of 1960 to 1964, an unusual perception of back-to-back yet primarily indistinguishable phases, unique in music history. Major artists that may have started as doo wop acts but we’re turning out slick. ",99,https://open.spotify.com/playlist/7CmreRETnY6t2MdHrIiaIA
1puQ0hv40TUre24cFillJS,Best Rock songs of All Time,Top 1000 Rock songs of All Time,510,https://open.spotify.com/playlist/1puQ0hv40TUre24cFillJS
3Y0IIeAeLJMW2Okx4EQCkw,Top Hits of 2014,"¡The Top Hits of 2014 are here, follow now and stream your favorites!",68,https://open.spotify.com/playlist/3Y0IIeAeLJMW2Okx4EQCkw
5vGMsjreMahQxS4tk6wLi6,TOP 50 PUNJABI SONGS 2024,"Catch Up Punjabi Hits Songs Of 2024 🔥: Top 50 Trending punjabi songs•Latest Punjabi Songs • New Punjabi Songs•Best Punjabi Songs, Punjabimusic, Punjabisongs, Punjabihits, Punjabicharts, Punjabiculture, Punjabivibes, Punjabibeats, Latestpunjabisongs,  2025 Punjabimusic, Punjabiplaylist, bangers",306,https://open.spotify.com/playlist/5vGMsjreMahQxS4tk6wLi6
6hKpQSZLuscvISOPSCjr59,Top J-Pop,"crazy Japanese, fist-pumping electronica&#x2F;synth-rock anthem - send submission to felixlee5645@gmail.com",43,https://open.spotify.com/playlist/6hKpQSZLuscvISOPSCjr59
3XYqlmuPk5xGgqKQ7vjVH3,Top Hits Instrumental Covers,"Strings, sax, and piano covers of your favorite songs",257,https://open.spotify.com/playlist/3XYqlmuPk5xGgqKQ7vjVH3
2uIV6dGcqL5jDOpPalMYHK,date night🍷,BEST TOP SONGS TO LISTEN AND VIBE TO WITH YOUR PARTNER🥰,56,https://open.spotify.com/playlist/2uIV6dGcqL5jDOpPalMYHK
37i9dQZF1DX0P7PzzKwEKl,Top Hits of 2002,Rewind and rediscover big songs of 2002. Cover: No Doubt,100,https://open.spotify.com/playlist/37i9dQZF1DX0P7PzzKwEKl
0Kto54BXD64MGPYZHl337E,Migos Greatest Hits,Migos Greatest Hits - Migos Vibes - Migos Best Songs - Best of Migos - Migos Hits - Migos Top Songs - The Migos - Migos Bangers - Best Trap Hits - Top Trap Songs - Best Hip Hop Songs - Viral Hip Hop - Viral Rap Hits - Trap Rap Playlist - Frat Party Rap - Lit Party - Aux Bangers,61,https://open.spotify.com/playlist/0Kto54BXD64MGPYZHl337E
1M1lqrjsh6ClOrpNmQtCmk,Top 100 Bar Songs,,100,https://open.spotify.com/playlist/1M1lqrjsh6ClOrpNmQtCmk
6gbG6Wv7s8U58S96Ol4JWX,Shania Twain Greatest Hits,Best songs from the queen Shania Twain - Top best songs from Shania Twain - Shania Twain Best Songs - Shania Twain Top Hits - Shania Twain Greatest Hits - Shania Twain Playlist,56,https://open.spotify.com/playlist/6gbG6Wv7s8U58S96Ol4JWX
7wmyXJFCHPBh6TR5TDvb8E,R&B All Stars,Discover the best R&amp;B hits from the top artists. Your ultimate R&amp;B collection.,52,https://open.spotify.com/playlist/7wmyXJFCHPBh6TR5TDvb8E
1csn1Wceh3aNJxIMG9UWEV,Badshah Top 20 Hits,Follow for more like this,22,https://open.spotify.com/playlist/1csn1Wceh3aNJxIMG9UWEV
41Qgn46dISDuUp4oynvZCd,Rock N Roll - BEST of 80s 90s and 2000s Playlist,"Rock N Roll - BEST of 80s 90s and 2000s playlist top songs in rock from past and present. Featuring the Eagles, Queen, The Killers, Pink Floyd and Bryan Adams.",137,https://open.spotify.com/playlist/41Qgn46dISDuUp4oynvZCd
6YdFz1nIUka16D5TYUZnzP,Rock EDC,all the top rock tracks according to my taste - anapaulade1souza@gmail.com,53,https://open.spotify.com/playlist/6YdFz1nIUka16D5TYUZnzP
6CYNhEcugsrbGnQP6tPR0N,DJ latin,"Latin party 2024, the top tracks that you need to hear all day everyday Share @ yelisa4215@gmail.com",54,https://open.spotify.com/playlist/6CYNhEcugsrbGnQP6tPR0N
2yf15hiBRKPKPQlJNfENUE,TOP 50 PHONK SONGS OF 2024 - MOST POPULAR TIKTOK PHONKS 2024,"CONTACT DM: @allsoundstream (IG); ELITE BRAZILIAN PHONK&#x2F;FUNK HITS 2024🔥, BEST OF THE YEAR💪, Aggressive Phonk TESTOSTERONE BOOST, DEEP BRAZILIAN PHONK PLAYLIST, GYM FUNK MIX, phonk, phonkplaylist, phonk2024, phonk2023, aggressivephonk, brazilianfunk, brazilianphonk, brazilphonk, gymphonk, testosteron",84,https://open.spotify.com/playlist/2yf15hiBRKPKPQlJNfENUE
2xRGmKkbMkHhEtwZ1SYD1y,Top 100 Piano Covers - Best of 2010's & 2020s - Cover Versions Of Pop Songs For Study (2010-2024),Piano covers of the best Billboard Hot 100 pop songs on Spotify from the 2010s and 2020s,163,https://open.spotify.com/playlist/2xRGmKkbMkHhEtwZ1SYD1y
