Playlist ID,Nombre Playlist,Descripción,Número de canciones,Url de Spotify
1nZpLA56VbyXsEG2VqRonU,Best 70s and 80s Music Hits Playlist - Greatest Songs of The 70s and 80s (Top Artists & Bands),Find our playlist with these keywords: best 80s music playlist - 70s music mix - 1970s 1980s songs - 70s music essentials - 70s top artists - 80s hit songs - 70s and 80s songs - 1970s and 80s music - 70s 80s music greatest hits - throwback songs 70s and 80s - best bands 70s 80s  - 70s 80s artist,150,https://open.spotify.com/playlist/1nZpLA56VbyXsEG2VqRonU
37i9dQZEVXbJvfa0Yxg7E7,Top 50 - Norway,Your daily update of the most played tracks right now - Norway.,50,https://open.spotify.com/playlist/37i9dQZEVXbJvfa0Yxg7E7
3tgKheDP8ghuLLgbXZUq4F,Barry's Red Room Playlist ,The Red Room soundtrack @barryssingapore from the top instructors @lorna_murph @lifttoburn @joanne.boulat,448,https://open.spotify.com/playlist/3tgKheDP8ghuLLgbXZUq4F
37i9dQZF1DXd3AhRYJnfcl,التوب,"أفضل الأغاني المصرية الآن من قلب مصر إلى العالم🔥🔝. الغلاف: <a href=""https://open.spotify.com/artist/5abSRg0xN1NV3gLbuvX24M?si=d7JPElYyRYGjvFQaCC9_Qg""> عمرو دياب </a>",50,https://open.spotify.com/playlist/37i9dQZF1DXd3AhRYJnfcl
7kGnXMc2b4rNZcp1k5PyNh,The Blues Rock Hits,"Sit down and enjoy theses great songs from Stevie Ray Vaughan, B.B King, Kenny Wayne Shepherd, Jonny Lang, ZZ Top, Danielle Nicole, Walter Trout, Joe Bonamassa, Buddy Guy. Billy F Gibbons and more",230,https://open.spotify.com/playlist/7kGnXMc2b4rNZcp1k5PyNh
74h0NsXQdtaaXjMQVR25t5,Suena Mas Duro,El TOP 50 Que Suena Mas Duro!,46,https://open.spotify.com/playlist/74h0NsXQdtaaXjMQVR25t5
0p0qmfKUEEXOoQqI9zqNxY,Devi Sri Prasad All Time Hits | DSP Top 200 Hits,All DSP Hits at one place. DSP Top 200 Hit Songs. Telugu Hit Songs. Suggest more songs at gvsreddy.spotify@gmail.com,249,https://open.spotify.com/playlist/0p0qmfKUEEXOoQqI9zqNxY
2moGBchxawu9eNHJq0wvx5,Lo Más Sonado 2024 🔥 ¡Latino Hits! | Reggaeton 2025,"Escucha aqui lo mas sonado en spotify | Top 50 Global | Los 50 más Virales | Reggaetón 2024 | Éxitos 2024 | Lo Más Nuevo 2024 | Reguetón 2024  | Lo más sonado | Música Nueva | Música variada | Música Top | Lo mas Sonado Peru, Chile, Colombia, Paraguay, Argentina, Mexico, España, Spain",120,https://open.spotify.com/playlist/2moGBchxawu9eNHJq0wvx5
6avzKVFyk3bPP3UY8fp3X3,Top 100 Country and Southern Gospel Songs,The Southern Gospel Country Music Chart from CountryChart.com is one of the most comprehensive Southern Gospel &amp; Country Gospel charts on the internet. We carefully highlight and spotlight the most important trending and popular Country Gospel music artists&#x27; albums and singles.,139,https://open.spotify.com/playlist/6avzKVFyk3bPP3UY8fp3X3
6q6DzFMMwpYeU2a90J5IyJ,1976 Billboard's Top 100 Hits,,109,https://open.spotify.com/playlist/6q6DzFMMwpYeU2a90J5IyJ
37i9dQZEVXbL3J0k32lWnN,Top 50 - Denmark,Your daily update of the most played tracks right now - Denmark.,50,https://open.spotify.com/playlist/37i9dQZEVXbL3J0k32lWnN
2FaNTRH29hN9ojOwx1hmlm,周深TOP精選,,44,https://open.spotify.com/playlist/2FaNTRH29hN9ojOwx1hmlm
2DDixxyA6jJO0NRVsuZlrj,TOP 50,"Traveling Music è la tua compagna ideale per ogni avventura. Che tu sia in viaggio o stia solo sognando la tua prossima avventura, questa playlist creerà l&#x27;atmosfera perfetta con un mix di brani energizzanti e rilassanti per accompagnarti.",55,https://open.spotify.com/playlist/2DDixxyA6jJO0NRVsuZlrj
0QqFRgPDgKWLJqrdFEQHdu,Weekly Top Hard Rock/Metal 11-02-24,Fuck the dog star.  Updated weekly. ,15,https://open.spotify.com/playlist/0QqFRgPDgKWLJqrdFEQHdu
37i9dQZEVXbKkidEfWYRuD,Top 50 - Ukraine,Your daily update of the most played tracks right now - Ukraine.,50,https://open.spotify.com/playlist/37i9dQZEVXbKkidEfWYRuD
7EKWxCA0Ip1y3mDNycr4Dk,Top 50 Rock Songs 2024,You can also find us with: best rock music 2024 - popular rock music 2024 - rock music mix - top rock songs 2024 - rock mix - best rock playlist - best rock songs 2024 - best rock playlist 2024 - top rock songs - rock songs - top 50 rock songs - popular rock music - rock mix 2024 - best rock songs - rock songs 2024 - top 50 rock songs 2024 - best rock music - rock music mix 2024,50,https://open.spotify.com/playlist/7EKWxCA0Ip1y3mDNycr4Dk
37i9dQZF1E8LfTzGxOhUul,Topdown Radio,"With Channel Tres, Peggy Gou, Polo & Pan and more",50,https://open.spotify.com/playlist/37i9dQZF1E8LfTzGxOhUul
0mfHYoSknbyWcp6Wg8JLmx,best carseat headrest songs in order ,top-favs (i change the order after relistening alot lol sorry) (@ecifircas.suoicilam on insta teehee),76,https://open.spotify.com/playlist/0mfHYoSknbyWcp6Wg8JLmx
1ra3sBLh3Npaix7ui5aUO8,Top 100 Thai Song 2024 (New Thai Music 2024),Find our playlist with these keywords: thai hits 2024 - new thai music 2024 - popular thai songs 2024 - top thai music 2024 - latest thai songs 2024 - thai music hits 2024 - thai playlist 2024 - best thai songs 2024 - thai charts 2024 - 2024 thai music hits - thai top 100 2024 - thai mix,100,https://open.spotify.com/playlist/1ra3sBLh3Npaix7ui5aUO8
33PeNixoul66i3IVVPdZpm,Chicano Rap,Top #1 Playlist ~ Soy Chingon Ese ~ Chicano Rap,173,https://open.spotify.com/playlist/33PeNixoul66i3IVVPdZpm
4wiiefyAbGy1Fdv7Zj0BlS,2018 Top Country Music,,241,https://open.spotify.com/playlist/4wiiefyAbGy1Fdv7Zj0BlS
5kDh15xAP20eJVEi6G0VoB,Top 100 Hair Nation Tunes,,92,https://open.spotify.com/playlist/5kDh15xAP20eJVEi6G0VoB
4e36iSHdNaSDaIfOKmCvXd,2024 HITS VIRAL 🍍/  Best Songs 2024 & Top Charts 2024 /,"NEW HITS 2024 &amp; TOP VIRAL TIK TOK 2024 : June 2024 Update  ( Best Hits 2024 Hits ) Top Hits 2024 Playlist. The most hottest songs hitting the charts 2024.  Latest Hits Pop Songs, Hip Hop &amp; Rap, EDM Hits &amp; Latin Global Hits. Best Hits 2023 &amp; Latest hits Summer 2024 - ",272,https://open.spotify.com/playlist/4e36iSHdNaSDaIfOKmCvXd
7MUBAm6nJvr8D3LuBTrYTC,2024 KTV點播排行 - Nov 🎤  Update,好樂迪、錢櫃點播排行每月更新 Top KTV songs in Taiwan,125,https://open.spotify.com/playlist/7MUBAm6nJvr8D3LuBTrYTC
2mVGvihUSMZTUylRO91At2,TOP NEW RELEASES - AUTUMN SOUNDS,Autumn Sounds Playlists. Email me: ContactEdenSounds@gmail.com,46,https://open.spotify.com/playlist/2mVGvihUSMZTUylRO91At2
0LVumUAmHS8DBu3XnYAHR8,Clean Fall Playlist 2024 🍂,clean fall playlist 2024 all top popular songs autumn country trending red leaves hot chocolate rainy days noah kahan taylor swift zach bryan girl in red,151,https://open.spotify.com/playlist/0LVumUAmHS8DBu3XnYAHR8
19Yeu8r8mAoBuxkul7ljyw,Só as Tops Internacional 2024,Melhores Internacionais 2024 Hits Internacionais 2024 POP en Ingles 2024 Sucessos pop 2010 a 2015,261,https://open.spotify.com/playlist/19Yeu8r8mAoBuxkul7ljyw
601L7cZSzQoVvZVPZZIvLf,Good Ol’ Rocky Top 🧡,,22,https://open.spotify.com/playlist/601L7cZSzQoVvZVPZZIvLf
0Q1CJWB7YUgi0eBt1KX8GY,Top Anime Openings 2024 / アニメソング,"Most popular anime songs from Demon Slayer, Jujutsu Kaisen, Attack on Titan, Black Clover, Tokyo Ghoul, Naruto, Bleach, Hero Academia, One Punch Man, Gintama, Fairy Tail, JoJo, Fate&#x2F;Zero, Slime, Re:Zero, Soul Eater, Fullmetal Alchemist, Death Parade, Nisekoi, 5-toubun, Blue Exorcist, One Piece, more",692,https://open.spotify.com/playlist/0Q1CJWB7YUgi0eBt1KX8GY
37i9dQZEVXbKQ1ogMOyW9N,Top Songs - France,Your weekly update of the most played tracks right now - France.,50,https://open.spotify.com/playlist/37i9dQZEVXbKQ1ogMOyW9N
44IU4j4hQ8fB5cCEmSig1E,Rap Italiano 🇮🇹,Trap - Trap Italia - Top Rap Italia - Hit Del Momento - Canzoni Del Momento 2024 - Top Hits Italia - Canzoni Rap Italiane - Hip Hop Italiano - Italiane,55,https://open.spotify.com/playlist/44IU4j4hQ8fB5cCEmSig1E
37i9dQZEVXbKGcyg6TFGx6,Top 50 - Luxembourg,Your daily update of the most played tracks right now - Luxembourg.,50,https://open.spotify.com/playlist/37i9dQZEVXbKGcyg6TFGx6
7mfYm0btgVvLXdeC7wiV7K,Saving Country Music's Top 25 Current Playlist,"The top 25 (or so) tracks coming out in country and roots right here, right now, painstakingly curated by Saving Country Music.",27,https://open.spotify.com/playlist/7mfYm0btgVvLXdeC7wiV7K
37i9dQZF1DXcDImPurtYrn,Top Kannada Tracks of 2023,Songs that you've listened the most this year! Cover:  Sapta Sagaradaache Ello - Side B #SpotifyWrapped,50,https://open.spotify.com/playlist/37i9dQZF1DXcDImPurtYrn
1dyb3iCpfLYBQxdOjRuOme,2003 Billboard Year End Hot 100,The top 100 songs of 2003 according to Billboard Magazine.,100,https://open.spotify.com/playlist/1dyb3iCpfLYBQxdOjRuOme
5ows8MyC8CN95GTbgTovnd,1975 BillBoard Top 100 hits.,,104,https://open.spotify.com/playlist/5ows8MyC8CN95GTbgTovnd
37i9dQZF1DXbdTzLVot2nl,Good Feeling 80s,Feel on top of the world with these uplifting anthems of the 80s,60,https://open.spotify.com/playlist/37i9dQZF1DXbdTzLVot2nl
4HhUEnmxd7fqU9bqzb3q1r,TOP BRASIL  (AS MELHORES),"Explore o melhor da música brasileira nesta playlist repleta de sucessos! De artistas consagrados a novos talentos, esta seleção vai te levar por uma viagem musical pelos ritmos e estilos mais populares do Brasil. Atualizada regularmente, sempre trazendo as últimas novidades da cena musical brasilei",230,https://open.spotify.com/playlist/4HhUEnmxd7fqU9bqzb3q1r
6nmemJH8z6PxA4zAIGeQUL,Polish Music 2024 - Best Polish Hits 2024 Playlist (Top Songs Poland 2024),Find our playlist with these keywords: polish hits 2024 - top polish songs 2024 - poland music chart 2024 - new polish music 2024 - polish artists 2024 - poland top hits playlist - best of poland music - poland music hits 2024 - polish music 2024 - polish songs 2024 - top polish music 2024,40,https://open.spotify.com/playlist/6nmemJH8z6PxA4zAIGeQUL
4ghALhDPw3vyRRQgXqlu0q,"No, This Is Lana Del Rey","My Top 3 Albums : Norman Fucking Rockwell, Ultraviolence &amp; Honeymoon",115,https://open.spotify.com/playlist/4ghALhDPw3vyRRQgXqlu0q
2OEWSMHo958SkcNFDXm1r8,Old School Jams,"90s &amp; 00s Hip Hop, Top 40, Rap, R&amp;B",608,https://open.spotify.com/playlist/2OEWSMHo958SkcNFDXm1r8
37i9dQZF1DX8cr9zdmLTqV,Top Hits de 2013,Relembre e descubra grandes sucessos em 2013. Foto: Bruno Mars,70,https://open.spotify.com/playlist/37i9dQZF1DX8cr9zdmLTqV
75fVOqCYhBdM7zBbgoCKY5,The The: Top Tracks,"A selection of The The’s top tracks including This Is The Day (as heard in Guardians Of The Galaxy Volume 3), Uncertain Smile, Giant, Soul Mining, The Sinking Feeling, I’ve Been Watin’ For Tomorrow (All Of My Life) and many more!",60,https://open.spotify.com/playlist/75fVOqCYhBdM7zBbgoCKY5
6g40a9GjWBkX8ewR0vF9C2,DANCE MUSIC 2024 🙌 Best Dance 2024 & EDM Hits 2024 & 2020s,Best dance music right now! Discover the latest dance and EDM hits. 2024 Top Dance Music. Most danceable songs 2020s,332,https://open.spotify.com/playlist/6g40a9GjWBkX8ewR0vF9C2
6a0UYJwdnpNG183p3FUDQW,Thanksgiving Dinner Playlist🦃🥂,the perfect thanksgiving playlist to drown out that one aunt when she starts discussing controversial topics at the dinner table,77,https://open.spotify.com/playlist/6a0UYJwdnpNG183p3FUDQW
4WGbawFfGeSCMqtzygVNAH,Bass House 2024 💙 Car Music,"Bass House 2024 💙 Car Music, featuring the best music. Update Daily 🔥 Contact: topfiguremusic@gmail.com",50,https://open.spotify.com/playlist/4WGbawFfGeSCMqtzygVNAH
5TQjirT55qqKCxDfpoSCEX,Turkish Music 2024 - Beste Türkische Musik (Top Turkish Songs 2024),Find our playlist with these keywords: turkish music mix 2024 - top turkish songs - gute türkische musik - famous turkish song 2024 - turkish music 2024 mix - beste türkische lieder 2024 - top songs turkey 2024 - popular turkish songs 2024 - beste türkische musik 2024 - turkish playlist 2024,80,https://open.spotify.com/playlist/5TQjirT55qqKCxDfpoSCEX
5Mg5lGHU5nG7XWRQTLBlic,Disney Lofi,"Listen to iconic <a href=""spotify:user:128899670"">Disney</a> hits featuring favorites reimagined by top artists in the Lofi space with a chill new vibe perfect for studying, creating, or unwinding.",42,https://open.spotify.com/playlist/5Mg5lGHU5nG7XWRQTLBlic
5WNgWXiGD1STuroWIZDfub,TOP AFROBEATS PARTY MIX 2023 / 2024 🔥🔥,"Afrobeats songs from 2023 &amp; 2024 🥳 Naija party, Lagos party, top Afrobeats hits, Detty December 2024",183,https://open.spotify.com/playlist/5WNgWXiGD1STuroWIZDfub
4LDnL81lbN6ndYY86ApQAA,2004 Billboard Year End Hot 100,The top 100 songs of 2004 according to Billboard Magazine.,100,https://open.spotify.com/playlist/4LDnL81lbN6ndYY86ApQAA
6XFOsAdp88ptBCdqUMAfmP,Nhạc Việt Hay Nhất Trên Spotify - VPOP 2021 On Spotify - Vpop Top Hits - Top 100 Việt Nam,,152,https://open.spotify.com/playlist/6XFOsAdp88ptBCdqUMAfmP
3URniFGTA4u6q3ifynoIiI,Andrew Peterson - Top 25 Songs,,25,https://open.spotify.com/playlist/3URniFGTA4u6q3ifynoIiI
62iR5uMfSkkxQfARWIgrz1,Afro House  Remix J. Balvin Hugel & Topic - I adore you,Afro House Hugel &amp; Topic - I adore you sunset summer afromusic afrobeats arash daecolm  balvin remix ,87,https://open.spotify.com/playlist/62iR5uMfSkkxQfARWIgrz1
37i9dQZEVXbLw80jjcctV1,Top Songs - Nigeria,Your weekly update of the most played tracks right now - Nigeria.,50,https://open.spotify.com/playlist/37i9dQZEVXbLw80jjcctV1
37i9dQZEVXbJUPkgaWZcWG,Top Songs - Italy,Your weekly update of the most played tracks right now - Italy.,50,https://open.spotify.com/playlist/37i9dQZEVXbJUPkgaWZcWG
41gXyhLcGEH0jXJYoORkbo,Vietnam Club Mix,"Vietnam Top #100 ( 𝐇𝐨𝐮𝐬𝐞 𝐌𝐮𝐬𝐢𝐜 ) Remix of Hits songs, Hiphop, Chill, Dance, Deep, Vinahouse, Trends &amp; more",116,https://open.spotify.com/playlist/41gXyhLcGEH0jXJYoORkbo
37i9dQZF1E4yJFXGxLt3Er,TOPS Radio,"With Drugdealer, Connan Mockasin, Tennis and more",50,https://open.spotify.com/playlist/37i9dQZF1E4yJFXGxLt3Er
1GVML4g7DEDyCaMohkmrkd,TECHNO DE ORO 9O'S MIX TOP 100 BEST HITS TAKE ON ME BELIEVE MIX TECHNO 90 CLÁSICOS EURODANCE LA BOUC,"Lo mejor de los 80s 90s los mejores FLASHBACK éxitos de la mejor época Techno, Rock, Pop, Wave, La Bouche, Modern Talking, Pedro pe Londonbeat, 2 Unlimited, Do you Know, Believe solo éxitos la bouche dj bobo locomia John Travolta Olivia Newton radio oasis lo mejormecano éxitos de los 80&#x27; dj bo",548,https://open.spotify.com/playlist/1GVML4g7DEDyCaMohkmrkd
4IOsJPS0rgo4XvtWZinlL7,Top Alternative Clean,,533,https://open.spotify.com/playlist/4IOsJPS0rgo4XvtWZinlL7
6wCqlVZVPhs53gy5AveIDm,Philippines Song 2024 - Top Pinoy 2024 Playlist - Music Philippines 2024 - Best Pinoy Music 2024,You can also find us with: music philippines 2024 - philippines song 2024 - popular music philippines 2024 - pinoy songs mix - pinoy music 2024 - philippines song - best pinoy music 2024 - pinoy playlist - top pinoy songs 2024 playlist - pinoy songs 2024 - best pinoy - music philippines,70,https://open.spotify.com/playlist/6wCqlVZVPhs53gy5AveIDm
3WZaJeRfxz0NtHOXrTaKlI,Türkçe pop 2000'ler 2010'lar❤️‍🔥,2000&#x27;ler 2010&#x27;lar Türkçe pop şarkılarının toplandığı çalma listesi. Keyifli dinlemeler💃,210,https://open.spotify.com/playlist/3WZaJeRfxz0NtHOXrTaKlI
7sOs3l4qZcBgMnFsfWFU9Z,Today's Best Comedians (Top Comedy),Some of the best Comedians and Comedy Ablums from the past decade. Including local and international artists who are guaranteed to make you laugh. Some of the most quotable and joyous comedy you could listen to.,655,https://open.spotify.com/playlist/7sOs3l4qZcBgMnFsfWFU9Z
5vwa9PNnpysFngDtOFg5Tu,• FORRÓ DAS ANTIGAS | SÓ AS TOPS 🪗🌵,"Aviões do Forró, Calcinha Preta, Mastruz com Leite, Magníficos, Banda Líbanos, Quatro Ases e Um Curinga, Limão com Mel, Brucelose, Saia Rodada, Desejo de Menina, Cavalo de Pau, Cavaleiros do Forró, Forró do Muído, Garota Safada, Forró Saborear, Sacode, Banda da Loirinha e muito mais!",237,https://open.spotify.com/playlist/5vwa9PNnpysFngDtOFg5Tu
0OGjalW4lKiVH7CS02veW4,Top Alt Songs! - Current,"Updated regularly, this playlist consists of the top 18 to 22 alternative songs in the nation and around the world. 2024 Alt",18,https://open.spotify.com/playlist/0OGjalW4lKiVH7CS02veW4
4D0h40lbOp3qwtQ0cHW7Wi,Top SALSA  80s & 90s,Las mejores canciones más exitosas de la salsa en los años 80 y 90.,234,https://open.spotify.com/playlist/4D0h40lbOp3qwtQ0cHW7Wi
3dZ9CrxDznN1z11fFLpDbP,Top Motivational Speeches ,,21,https://open.spotify.com/playlist/3dZ9CrxDznN1z11fFLpDbP
4TJfrfTp0Dk5KvZ9fxL0ru,2024 Best Black Country Artists,A compilation of the top country hits from Black Country Artists ✨💕,189,https://open.spotify.com/playlist/4TJfrfTp0Dk5KvZ9fxL0ru
1W8hyKwRFGG5HWRQEtNF3S,Billboard Country Top 100 ,"November  3,  2024. Country AirPlay Hot 100 List",102,https://open.spotify.com/playlist/1W8hyKwRFGG5HWRQEtNF3S
44I4U9Rbo9CPkHGrdlmp6r,2015 Top Country hits,,54,https://open.spotify.com/playlist/44I4U9Rbo9CPkHGrdlmp6r
37i9dQZF1DZ06evO1EL6RH,This Is TOPS,"This is TOPS. The essential tracks, all in one playlist.",50,https://open.spotify.com/playlist/37i9dQZF1DZ06evO1EL6RH
37i9dQZEVXbJPcfkRz0wJ0,Top 50 - Australia,Your daily update of the most played tracks right now - Australia.,50,https://open.spotify.com/playlist/37i9dQZEVXbJPcfkRz0wJ0
3MqbwNTAD3rQZVrLzz50ji,Lata mangeshka TOP 50 SONGS,,50,https://open.spotify.com/playlist/3MqbwNTAD3rQZVrLzz50ji
0UzVufQNOoIu6nfxrUgZ9O,The 50 Greatest One-Hit Wonders of All Time,Check out our picks for the best chart-topping anomalies.,50,https://open.spotify.com/playlist/0UzVufQNOoIu6nfxrUgZ9O
1iL9OduftkS3TTUYY9kbkg,NON-EXPLICIT Top Hits,,191,https://open.spotify.com/playlist/1iL9OduftkS3TTUYY9kbkg
7HFppAZA5pylLyWV9KOWDV,Manisharma Top 100 Hits | Telugu,Enjoy The Best Melody Hits of Manisharma (Melody Brahma). Suggest more songs at gvsreddy.spotify@gmail.com,172,https://open.spotify.com/playlist/7HFppAZA5pylLyWV9KOWDV
1zQiQC9aSzrzVOjAdlulcD,REELS TRENDING | Trending Hindi Songs (New releases) | Top New MUSIC VIRAL HITS,,63,https://open.spotify.com/playlist/1zQiQC9aSzrzVOjAdlulcD
37i9dQZF1DX6wfQutivYYr,Hot Hits Italia,Achille Lauro in cover della più grande playlist in Italia! 🏆,50,https://open.spotify.com/playlist/37i9dQZF1DX6wfQutivYYr
4x4lZ8VV6oxdRdTwFgoFg7,Gothic Vibes,"gothic music playlist 2024 | best gothic songs | darkwave, post-punk &amp; gothic rock | music for goths | top gothic music | goth playlist | songs that sound gothic",53,https://open.spotify.com/playlist/4x4lZ8VV6oxdRdTwFgoFg7
37i9dQZF1DWZWNsJrgFkZK,Hot Hits Haryanvi,Catch all the top Haryanvi hits. Cover: Sapna Choudhary,50,https://open.spotify.com/playlist/37i9dQZF1DWZWNsJrgFkZK
71OBVouynnNfpV5dwc8abm,HOLY GHOST RADIO,Well-crafted collection of indie Christian’s top hits and artists. The heartbeat jams of Holy Ghost Record Club. ,85,https://open.spotify.com/playlist/71OBVouynnNfpV5dwc8abm
3eNmXt2rrtHdmYoGlo9ecQ,Mainstage 2024 ❤️‍🔥 EDM - Festival,"Mainstage 2024 ❤️‍🔥 EDM - Festival , featuring the best music. Update Daily 🔥 Contact: topfiguremusic@gmail.com",50,https://open.spotify.com/playlist/3eNmXt2rrtHdmYoGlo9ecQ
3AEkt2VeAAHFc1TC5FLuIl,Chinese KTV 300 Top Hit Songs (Mandopop) 2024,"Top Chinese Mandopop KTV hits from 80s, 90s, and recent updates! Curated since 2016 (updated Sept 2023). Do share the playlist with your friends and family! Tags: Teo Heng, Tik Tok, Dou Yin,",328,https://open.spotify.com/playlist/3AEkt2VeAAHFc1TC5FLuIl
79fzFdgDjUdcguVtrDguND,Topazz y Pegaso,,26,https://open.spotify.com/playlist/79fzFdgDjUdcguVtrDguND
2mdnbXPiAYIDZZlQmahyTQ,UK Top 40 - 1st November 2024 ,UK Top 40 Charts | November 1st 2024 | 1st November | 01/11/2024 | 2024 Charts. Cover: Charli XCX &amp; Ariana Grande,40,https://open.spotify.com/playlist/2mdnbXPiAYIDZZlQmahyTQ
2SLokaKcysXRIY4IxsJ7o9,Japanese Top Hits,"Japanese songs and hits from the top Spotify Japan charts ft. Ado, back number, Fujii Kaze, Higedan, Kenshi Yonezu, King Gnu, Mrs. GREEN APPLE, YOASOBI, Yorushika and more.",232,https://open.spotify.com/playlist/2SLokaKcysXRIY4IxsJ7o9
46Zihfdn2igQS9y5O2Mg1x,✨ Manifest Mu$ic ✨,Mello Will’s Top songs to manifest to. share with a friend :) TikTok: @manifestmusicplaylist,166,https://open.spotify.com/playlist/46Zihfdn2igQS9y5O2Mg1x
37i9dQZF1DWVYasTznT0KT,Best TV & Movie Tracks of 2023,"From ""I'm Just Ken"" to ""World Class Sinner,"" here are all the top tracks from our fave Series and Movies in 2023! Cover: Ryan Gosling, Barbie ",45,https://open.spotify.com/playlist/37i9dQZF1DWVYasTznT0KT
0C0j4BOHdpDCk9z1Ka9u6z,FUNKS DO TIKTOK 🔥 2024 - 2025,FUNKS DO TIKTOK NOVEMBRO DEZEMBRO - 2025 🧨 Top funk mais tocados no tiktok e Instagram para você se atualizar. Relaxa a bct mulher - só vou deixar você marcada - ei moto taxi - quem não quer sou  eu - Na onda da bala love  - chegou minha encomenda - No baile ela se arruma - lembra aquele cara,60,https://open.spotify.com/playlist/0C0j4BOHdpDCk9z1Ka9u6z
5wPPiFaaB4Ou88we5iWrj6,TOP EDM 2024,"Enjoy the best and hottest EDM🔥. Genres: Electronic and subgenres, Dance, Pop dance, Techno, Trance, and some Latino. Mostly, new artists discovery.",60,https://open.spotify.com/playlist/5wPPiFaaB4Ou88we5iWrj6
3c2L4VPLiBUSNkjehI1K1q,The Clash: Top Tracks | Should I Stay or Should I Go,"Every Clash track is a top track but here are some of the most popular, including Should I Stay or Should I Go heard on Stranger Things, Rock The Casbah, London Calling, I Fought the Law, Train in Vain, (White Man) in Hammersmith Palais and many, many more. Photo: Allan Tannenbaum.",45,https://open.spotify.com/playlist/3c2L4VPLiBUSNkjehI1K1q
5IBT4O6wv2ps9JA4o5qrjG,ENGLISH SONGS 2024 🔥 ENGLISH HITS 2024 🎵 BEST ENGLISH MUSIC 🎵,ENGLISH SONGS 2024 🔥 ENGLISH TOP HITS 2023 🎵 BEST ENGLISH MUSIC 🎵 Popular Songs 2024 - Today Top Hits - Top English Hits - Viral Hits - Radio Hits 2023/2024 - Top English Songs 2024  Best Of 2024 | The Vocal Deep House Mix - Top Songs  - Global Hits - Billboard Hits - Summer - Pop Songs - Pop Hits,95,https://open.spotify.com/playlist/5IBT4O6wv2ps9JA4o5qrjG
4DQZgwZeWrLpTRrTUiXPY7,New Punjabi Songs 2024 ( November ),"Every Day New Punjabi Songs 2024, New punjabi songs,latest punjabi songs 2024,punjabi songs 2024,new punjabi,punjabi new songs,top punjabi songs,punjabi music,Diljit Dosanjh songs,punjabi songs 2024,top 50 punjabi songs,ap dhillon New Songs,Trump,sifar safar Karan aujla,Punjabi Song,Popular hit song",584,https://open.spotify.com/playlist/4DQZgwZeWrLpTRrTUiXPY7
2Hlb71OJKq0t68pYxyc7Ce,Top 100 - Best Of Reggae,,100,https://open.spotify.com/playlist/2Hlb71OJKq0t68pYxyc7Ce
0SuqtbNBpCe3QFR8XyN63p,TOP WORKOUT PUNJABI 2024,"Top workout punjabi, Top punjabi workout, latest punjabi gym songs, Powerful punjabi songs, Punjabi workout songs, punjabi pump songs, punjabi gym songs, punjabi bodybuilding, punjabi gym power, best songs for working out, workout Punjabi,",204,https://open.spotify.com/playlist/0SuqtbNBpCe3QFR8XyN63p
19GcaLUFVt39dseiooUrb8,90s and 2000s Pop Hits Playlist - Top 100 Best Pop Songs of the 1990s & 00s,Find our playlist with these keywords: pop songs 90s 2000s - pop songs of the 1990s - 90s 00s pop playlist - 90s 2000s pop hits - 90s and 2000s pop hits - top pop songs 90s 00s - 90s 2000s pop songs - throwback pop songs - best pop songs 90s 2000s - pop songs of the 2000&#x27;s - pop mix 90s 2000s,100,https://open.spotify.com/playlist/19GcaLUFVt39dseiooUrb8
1JDBt0JUA4ybr6hAqbRqo9,Los Rancheritos Del Topo Chico  Boleros–,,12,https://open.spotify.com/playlist/1JDBt0JUA4ybr6hAqbRqo9
59LP3gSI53qsr22hgSlIi5,Deep House 2024 🧡 Chill Music - Beach Music,"Deep House 2024 🧡 Chill Music - Beach Music, featuring the best music. Update Daily 🔥 Contact: topfiguremusic@gmail.com",50,https://open.spotify.com/playlist/59LP3gSI53qsr22hgSlIi5
3SUN5AuTzxUaQrC55wB7RX,The Top 100 Very Best Rolling Stones Songs,,100,https://open.spotify.com/playlist/3SUN5AuTzxUaQrC55wB7RX
0Wxjvj6OebVXwnIVWI79Zz,Narodne 2024 | Top 100,Where Balkan folk music lives. Featuring Ana Kokic and more.,100,https://open.spotify.com/playlist/0Wxjvj6OebVXwnIVWI79Zz
0EN2gQhhn0rCYUR5BY1UJy,Billboard Top 100 This Week 2024 - Top 100 Billboard Songs 2024 (Best Billboard Music 2024),Find our playlist with these keywords: billboard hits 2024 - top songs 2024 - billboard 2024 chart - billboard top songs 2024 - billboard trending 2024 -  billboard 2024 songs -  billboard popular music 2024 - top billboard playlist 2024 - billboard hot 100 2024 - current billboard hits 2024,100,https://open.spotify.com/playlist/0EN2gQhhn0rCYUR5BY1UJy
5YEaz9cigc29KkAXHKarh6,Nuevas Canciones Top 2024,"Lo más viral de la semana @nuevascancionesoficial. Nuevas Canciones 2024, Canciones Nuevas 2024, Reggaeton 2024, Música Nueva 2024, Música Nueva, Musica Nueva 2024, Canciones Nuevas de Reggaeton, Regueton 2024, Perreo 2024.",50,https://open.spotify.com/playlist/5YEaz9cigc29KkAXHKarh6
7d4YzAmg1Cwtkyw98B3Erc,Disco Funk music  🕺 70  80  90 📻,"The Top of  the top: 70s, 80s, 90s, Disco, Funk Music, Soul Funk, Soul, Nu Disco,  New York, Studio 54, London, Miami Beach, Radio Ibiza, Ibiza Beach, Radio, American Radio, Spotify Playlist.",350,https://open.spotify.com/playlist/7d4YzAmg1Cwtkyw98B3Erc
6vE94FSvlCEjESLu7Ejsrb,New Age Piano Top 100,I've made a playlist of the top 100 new age and new classical pianists. I hope you find something new. I've also added my two newest albums at the bottom so the music doesn't stop :),235,https://open.spotify.com/playlist/6vE94FSvlCEjESLu7Ejsrb
4uKswQrI9K0wjO9zKj5Zmx,Greek Rap/Trap 2024/2025💦,ΌΛΑ ΤΑ TOP HITS ΤΗΣ ΕΛΛΗΝΙΚΗΣ RAP&#x2F;TRAP ΣΚΗΝΗΣ🔥,471,https://open.spotify.com/playlist/4uKswQrI9K0wjO9zKj5Zmx
0gwjM7SdYbDYMHustFRgHm,Latin Tech 2024 💛 Tech House - Afro House,"Latin Tech 2024 💛 Tech House - Afro House, featuring the best music. Update Daily 🔥 Contact: topfiguremusic@gmail.com",50,https://open.spotify.com/playlist/0gwjM7SdYbDYMHustFRgHm
49JVD3MN6O9zTI8OfpXVc7,tom odell's top tracks,all of my releases so far,109,https://open.spotify.com/playlist/49JVD3MN6O9zTI8OfpXVc7
