Playlist ID,Nombre Playlist,Descripción,Número de canciones,Url de Spotify
1IbbGstnGR04me7nEcRLvT,All NF Songs.,All songs by NF. It&#x27;s pretty self-explanatory. The playlist goes from new to old (top to bottom) with singles at the very bottom. !|-NF-|! Follow me on LinkedIn at https:&#x2F;&#x2F;www.linkedin.com&#x2F;in&#x2F;asher-fogie,124,https://open.spotify.com/playlist/1IbbGstnGR04me7nEcRLvT
52ed11cF35KOKnJsetko4M,David Bowie Official Playlist,"Listen to the brand new singles from the upcoming Rock 'n' Roll Star!, and the very best of David Bowie playlist including top tracks such as Heroes, Starman, and Space Oddity. ",83,https://open.spotify.com/playlist/52ed11cF35KOKnJsetko4M
5zYgmmRp9ozLstVry1JLbw,1995 - Billboard Top 100,Spotify take customer content complaints very seriously. Any abuse of the reporting process can result in the termination of the Spotify account. Rest assured our dedicated team had been made aware of this issue.,100,https://open.spotify.com/playlist/5zYgmmRp9ozLstVry1JLbw
37i9dQZF1EIWn6Vb4CvN1O,Tophouse Mix,"<a href=spotify:playlist:37i9dQZF1EIXmx94UeLahR>Rose Betts</a>, <a href=spotify:playlist:37i9dQZF1EIWG6Rt7BZGay>Ramblewood</a> and <a href=spotify:playlist:37i9dQZF1EIVZ0sKOtYvPp>Morningsiders</a>",50,https://open.spotify.com/playlist/37i9dQZF1EIWn6Vb4CvN1O
37i9dQZF1DX4V5eXk4NKqu,Top Latin Indie,"The best of Latin Indie today, featuring Judeline.",75,https://open.spotify.com/playlist/37i9dQZF1DX4V5eXk4NKqu
744pjxdDXa6tUKfz4vCpFM,Classical Music That SLAPS ,"Fun fact, actually really really sad fact, Debussy is my top listened artist",107,https://open.spotify.com/playlist/744pjxdDXa6tUKfz4vCpFM
1zU14nGxqc5QEfAv6PDthC,All-time Top Party Songs,,142,https://open.spotify.com/playlist/1zU14nGxqc5QEfAv6PDthC
6wW8rOnKj8o252v52pXutY,Top 100 Songs of The 80s,Find our playlist with these keywords: songs from the 80s - 1980s songs playlist - 80s songs playlist - music from the 80s mix - 80s music - 80s songs playlist names - top 100 songs of the 80s - music from the 80s - top songs of the 80s - 80s songs playlist - 80s songs - 1980s music hits,100,https://open.spotify.com/playlist/6wW8rOnKj8o252v52pXutY
6YxvB3fPrlBIAq99uMKnM6,1983 - Billboard Top 100 Songs,"Missing songs: &quot;Electric Avenue&quot; - Eddy Grant (#22), &quot;Mickey&quot; - Toni Basil (#36)",99,https://open.spotify.com/playlist/6YxvB3fPrlBIAq99uMKnM6
43lYqHtPjx7dEeGkerF7oB,Zach Top Radio,,85,https://open.spotify.com/playlist/43lYqHtPjx7dEeGkerF7oB
37i9dQZEVXbN6itCcaL3Tt,Top 50 - Poland,Your daily update of the most played tracks right now - Poland.,50,https://open.spotify.com/playlist/37i9dQZEVXbN6itCcaL3Tt
6bHjBCFN8Lqj0K54RWFci8,1979 - Billboard Top 100,,100,https://open.spotify.com/playlist/6bHjBCFN8Lqj0K54RWFci8
7j2QP1yw2BESw5lhyRp4lg,Top 2020-2023 Country Hits,"This Playlist has hits of the last three years, plus some extra classics! when you feel like you need some you time, you can listen here.",55,https://open.spotify.com/playlist/7j2QP1yw2BESw5lhyRp4lg
34ymXV7mcsQeMO4VnT3DIN,Today’s Top Hits Radio🔥,,354,https://open.spotify.com/playlist/34ymXV7mcsQeMO4VnT3DIN
0FMAAt4KT6nYmLj3rwWIxo,Portugal Top Hits 🇵🇹,"As Mais Tocadas em Portugal: Top 50 chart com os maiores sucessos, a melhor música para dançar, Pop de Reggaeton, R&amp;B, Hip-Hop Tuga, Comercial. Artistas como Bispo, Van Zee, Julinho Ksd, Slow J, Syro e Bárbara Bandeira, Ivandro, Dillaz, Plutonio, Bárbara, ProfJam, Quatro e Meia, Calema",77,https://open.spotify.com/playlist/0FMAAt4KT6nYmLj3rwWIxo
2wu8Khf5JEw98Lwu93jAgp,Disney top hits,,41,https://open.spotify.com/playlist/2wu8Khf5JEw98Lwu93jAgp
1wEVPP2Sc4oHsOJyN7RxaN,Bob Dylan – 100 greatest songs,Rolling Stone magazine&#x27;s ranking of the top 100 tracks from the Nobel Laureate&#x27;s vast career,100,https://open.spotify.com/playlist/1wEVPP2Sc4oHsOJyN7RxaN
1iCnOzggr9JO0Pws2gn5rv,Top 100 Songs of 2010-2020,The top 100 songs of 2010-2020 according to billboard. Please note that this playlist is explicit,100,https://open.spotify.com/playlist/1iCnOzggr9JO0Pws2gn5rv
3uLYTqhQQvagFi9R3Wy1AH,Best Female Hip-Hop & Rap Songs of All Time (Women of Rap & Hip-Hop),Find our playlist with these keywords: female rap hits - women hip hop songs - best female rappers playlist - top female rap songs  - female rap music mix - top girl rap songs - female rap and hip hop - best female rappers all time - female hip hop mix - girl hip hop songs - lady hip hop artists,70,https://open.spotify.com/playlist/3uLYTqhQQvagFi9R3Wy1AH
37i9dQZEVXbMZAjGMynsQX,Top 50 - Costa Rica,Your daily update of the most played tracks right now - Costa Rica.,50,https://open.spotify.com/playlist/37i9dQZEVXbMZAjGMynsQX
37i9dQZF1DX0OEZC3cbQmU,Sucessos Gospel,A palavra do Senhor na voz de grandes adoradores do Brasil. Foto: Isadora Pompeo,75,https://open.spotify.com/playlist/37i9dQZF1DX0OEZC3cbQmU
6w9yXoENbUZawha9wCuW9o,Telugu Top 1000 Hits | All Time Hits,Mid 90s to Latest Hits. Telugu All Time Hits. Handpicked Hits. Suggest more songs at gvsreddy.spotify@gmail.com,1678,https://open.spotify.com/playlist/6w9yXoENbUZawha9wCuW9o
7BmwrqOLT08Yiu5YWprTgP,Today's Top Hits,Welcome To Today&#x27;s Top Hits 🎧 - house music - pop music - edm - For Submissions: federicamilanopromo@gmail.com,41,https://open.spotify.com/playlist/7BmwrqOLT08Yiu5YWprTgP
18ed2WSQNrEIrSBAShEf6S,Bass Drops 2024🔊 Hard EDM Drops Beat Drops Heavy Drops Beast Drops Insane Drops Wild Drops Bassdrops,big room - edm festival music - electro house - top edm - bigroom - 128 bpm - best edm - edm bangers - festival hits   - hardstyle - pump up music - festival bangers - trending - future rave music - goa music - bass bangers - happy hardcore - jbl bass test - hard style - psytrance - discoteca - idm,110,https://open.spotify.com/playlist/18ed2WSQNrEIrSBAShEf6S
4mEflwShLHpdpll6O2fh5r,Arabic Bass Boosted 2025  (Top 100) 🔥🔊 عربي,"Arabic Bass Music, EDM, and Techno music for your car or your speakers. Rockford Fosgate, boss, pioneer, bass musik für auto, tuning mix, real bass, gangsta edm 2024, best car music, auto cruisen, prollrunde, starker bass, bajo extremo, bass music, edm bass songs, house, deep house, slap house, عربي",83,https://open.spotify.com/playlist/4mEflwShLHpdpll6O2fh5r
0ycWLvwxtT5LIfZXFBpNaY,1974 - Billboard Top 100 Songs,"Missing songs: &quot;Let Me Be There&quot; - Olivia-Newton John (#26), &quot;If You Love Me (Let Me Know)&quot; - Olivia-Newton John (#32), &quot;I Honestly Love You&quot; - Olivia-Newton John (#97)",97,https://open.spotify.com/playlist/0ycWLvwxtT5LIfZXFBpNaY
6gmgILdEKcZim9gIPv02X9,Your Top Songs 2018,"Relive your favorite tracks from 2018, all in one playlist.",95,https://open.spotify.com/playlist/6gmgILdEKcZim9gIPv02X9
7g8u0OlmGHVMzuo1xHespc,Top Weekly,For Submissions: popmusikpromo@gmail.com - pop music - dance - indie pop - electro pop - pop party - top weekly,39,https://open.spotify.com/playlist/7g8u0OlmGHVMzuo1xHespc
37i9dQZF1DX6RbMTl2YnQ8,Rock en Español: Los 2000,"Lo mejor del rock en español en la década de los 2000. 
",50,https://open.spotify.com/playlist/37i9dQZF1DX6RbMTl2YnQ8
6WNlrNC0Jbf3TlO61smWj8,ZZ TOP HITS🟢BEST OF,This is ZZ TOP the radio mixtape playlist all songs discography mix lo mejor de exitos todas las canciones as melhores musicas live ,29,https://open.spotify.com/playlist/6WNlrNC0Jbf3TlO61smWj8
0YKbjLgCPsp7K3k2JH4NZw,1996 - Billboard Top 100,Missing Song: #69 - &quot;If Your Girl Only Knew&quot; by Aaliyah,106,https://open.spotify.com/playlist/0YKbjLgCPsp7K3k2JH4NZw
2zWpaYcdHXV4226EdRcV5K,Diljit Dosanjh All Songs,Listen to top hits of Diljit Dosanjh,307,https://open.spotify.com/playlist/2zWpaYcdHXV4226EdRcV5K
5AzQwHGapByXOKvX5pEEZN,90s Telugu Hits | Top 100 Hits,Finest Collection of 90s Telugu Hit Songs. Suggest more songs at gvsreddy.spotify@gmail.com,198,https://open.spotify.com/playlist/5AzQwHGapByXOKvX5pEEZN
37i9dQZF1DXbbu94YBG7Ye,Éxitos Argentina,"Si la rompe está acá. Foto: Dillom, Marilina Bertoldi, Juliana Gattas & Airbag.",50,https://open.spotify.com/playlist/37i9dQZF1DXbbu94YBG7Ye
37i9dQZEVXbJqfMFK4d691,Top 50 - Bolivia,Your daily update of the most played tracks right now - Bolivia.,50,https://open.spotify.com/playlist/37i9dQZEVXbJqfMFK4d691
37i9dQZF1DXbUFx5bcjwWK,Top Hits of 1993,Rewind and rediscover big songs of 1993. ,100,https://open.spotify.com/playlist/37i9dQZF1DXbUFx5bcjwWK
55Lkw9T1EcSHqWfolYnH4f,AR Rahman Top 100 Hits | Telugu,AR Rahman Telugu Hit Songs. Suggest more songs at gvsreddy.spotify@gmail.com,136,https://open.spotify.com/playlist/55Lkw9T1EcSHqWfolYnH4f
37i9dQZF1DWZ5voOVHP0HA,Top Malayalam Tracks of 2023,Songs that you've listened the most this year! Cover: Romancham #SpotifyWrapped,50,https://open.spotify.com/playlist/37i9dQZF1DWZ5voOVHP0HA
7hMWu0L2YrqFkRpcSzxq6l,Judas Priest: Top Tracks,"Celebrating 50 years of heavy metal music by looking back on favourite tracks from across the decades featuring Breaking The Law, Living After Midnight, Electric Eye and many more!",60,https://open.spotify.com/playlist/7hMWu0L2YrqFkRpcSzxq6l
4rhgAIno9OiopUzNhOZDbc,1986 - Billboard Top 100,Spotify take customer content complaints very seriously. Any abuse of the reporting process can result in the termination of the Spotify account. Rest assured our dedicated team had been made aware of this issue.,100,https://open.spotify.com/playlist/4rhgAIno9OiopUzNhOZDbc
3v7bNlgWgl5xMYPgHl4cNp,Top Christian 2024 | Top Christian Songs 2024,Worship Music 2024 | Top Christian Songs 2024 | Top Christian 2024 | Top Christian Music 2024 | Best Christian Music | Best Christian Songs | Best Christian 2024 | Top Worship Songs | Top Worship Music 2024 | New Christian 2024 | New Christian Worship 2024 | 2024 Christian songs | Best Worship Music,109,https://open.spotify.com/playlist/3v7bNlgWgl5xMYPgHl4cNp
4dk5iFzG60qLg0YtMHyjJ9,2020 - 2023 GREATEST HITS,Top Tracks On Tik Tok - Trending Music - The Most Famous Songs!,99,https://open.spotify.com/playlist/4dk5iFzG60qLg0YtMHyjJ9
2PPaVKnfSCiGOLCUEoZqQu,Persian Pop (2024) 🪩 Dance Party Hits Top New Happy Best Farsi Iran  جدید ایرانی پاپ شاد پارتی رقصی,"🔥 NEW 🔥 Iranian Pop Songs. Updates DAILY! Instagram 💬 @boutique.sound.studio | Alireza Talischi, Ragheb, Hamid Hiraad, Macan band, Aron Afshar, Behnam Bani, Hamed Baradaran, Shadmehr Aghili, Donya, Satin, Kimia, X band, Mohsen Ebrahimzadeh, Puzzle Band, Masih, Arash AP, Sasy",322,https://open.spotify.com/playlist/2PPaVKnfSCiGOLCUEoZqQu
3vsHedaQzvdgipf9Zod70x,NEW RAP BANGERS 🔥,Massive playlist of top hits and new artists ~ old and new rap bangers ~ **UPDATED WEEKLY**,1179,https://open.spotify.com/playlist/3vsHedaQzvdgipf9Zod70x
5icMx65GADu8ICFmK7BwrL,Top 10 podcasts for life ,,28,https://open.spotify.com/playlist/5icMx65GADu8ICFmK7BwrL
1CxTjYrA6DVfV8knVh4qUm,The Four Tops' Greatest Hits,,12,https://open.spotify.com/playlist/1CxTjYrA6DVfV8knVh4qUm
0JiVp7Z0pYKI8diUV6HJyQ,Spotify Top 500 Most Streamed Songs of All Time,Updated on October 30,500,https://open.spotify.com/playlist/0JiVp7Z0pYKI8diUV6HJyQ
37i9dQZF1DWZBhmSz1J4m8,Best of the Decade For You,"Some of the top songs from the last 10 years, in a playlist tuned to your taste.",100,https://open.spotify.com/playlist/37i9dQZF1DWZBhmSz1J4m8
1bk6tO6d5oes6n0vhACi5x,1982 - Billboard Top 100,,99,https://open.spotify.com/playlist/1bk6tO6d5oes6n0vhACi5x
3YIyuHDD3DtS91ANe1NbHN,Top Hindi Songs instrumentals,"Instrumental covers of famous &amp; hit Hindi songs, new and old!",71,https://open.spotify.com/playlist/3YIyuHDD3DtS91ANe1NbHN
1wTk1kDbM0Y7KqlQNdknTj,Top 50 Hits Produced by Quincy Jones,Based on “Billboard’s Hottest Hot 100 Hits”,50,https://open.spotify.com/playlist/1wTk1kDbM0Y7KqlQNdknTj
6q2dtkU2I1tR8ZVQI8mian,Top Israeli Hebrew Hits,Camp Background Music ,80,https://open.spotify.com/playlist/6q2dtkU2I1tR8ZVQI8mian
4xrfj1jmSp9Ks9KYfhtklb,Top Malayalam Christian Devotional Songs❤️🙏🙏,Feel-Good Grooves: Unwind and Unleash Your Inner Joy.👉 𝙁𝙊𝙇𝙇𝙊𝙒 𝙞𝙣𝙨𝙩𝙖𝙜𝙧𝙖𝙢 @𝗶𝘁𝘀_𝗺𝗲._.𝗮𝗹𝘄𝗶𝗻👈,33,https://open.spotify.com/playlist/4xrfj1jmSp9Ks9KYfhtklb
37i9dQZF1E4vNqKRpFiULn,Grupo Toppaz De Reynaldo Flores Radio,"With Los Reyes Locos, Sonido Mazter, Mister Chivo and more",50,https://open.spotify.com/playlist/37i9dQZF1E4vNqKRpFiULn
3DVacb1eLPsEf5zCBjtNyi,ZZ Top's Greatest Hits,,93,https://open.spotify.com/playlist/3DVacb1eLPsEf5zCBjtNyi
4TPsnlbjdxxpSThxJ8dkZ9,Halloween Songs 2024 (Top 100),,104,https://open.spotify.com/playlist/4TPsnlbjdxxpSThxJ8dkZ9
47fhTAlaJOAC7LPRk2kWBn,Mohammad Rafi Top 100,Top 100 songs of Mohammad Rafi. Hope you enjoy them ,100,https://open.spotify.com/playlist/47fhTAlaJOAC7LPRk2kWBn
7aCU5dk7g3iLg4dXUmKY71,Top Running Pop Songs 🏃‍♀️🏃🏿‍♂️🏃,This is the ultimate running playlist!! 🏃‍♀️🏃🏿‍♂️🏃,236,https://open.spotify.com/playlist/7aCU5dk7g3iLg4dXUmKY71
55fC8Etj7IL6fk3Oe7lpg5,Best Christmas 🎄 Instrumental Music 2024,Top peaceful Xmas songs on piano &amp; strings. Classical versions of carols &amp; classics on piano &amp; strings – for a relaxing &amp; spiritful holiday.,645,https://open.spotify.com/playlist/55fC8Etj7IL6fk3Oe7lpg5
4Y3NWTnl6XBB7b39ucRipt,This Is half•alive,all of our children so far...our newest is at the top,62,https://open.spotify.com/playlist/4Y3NWTnl6XBB7b39ucRipt
37i9dQZEVXbNOUPGj7tW6T,Top 50 - Paraguay,Your daily update of the most played tracks right now - Paraguay.,50,https://open.spotify.com/playlist/37i9dQZEVXbNOUPGj7tW6T
2dGr3sZrarvQAZx2AsbQgn,Best Female Pop Songs,Find our playlist with these keywords: female pop hits - top female pop songs - ladies pop songs - girl pop hits - popular female pop songs - girl pop songs - ladies pop music - biggest female pop songs - woman pop songs - girl pop playlist - woman pop playlist - girl pop mix - woman pop hits,150,https://open.spotify.com/playlist/2dGr3sZrarvQAZx2AsbQgn
37i9dQZF1DX9ZZCtVNwklG,Top Hits of 1992,Rewind and rediscover big songs of 1992. Cover: Whitney Houston.,100,https://open.spotify.com/playlist/37i9dQZF1DX9ZZCtVNwklG
37i9dQZF1DX7h5mLM5Kq4G,Top Party Hits of 2023,The songs we've been partying to in 2023. Cover:  #SpotifyWrapped,75,https://open.spotify.com/playlist/37i9dQZF1DX7h5mLM5Kq4G
1msY3c9fzgE3V11aNhsq2O,BRASIL 2024 - AS MELHORES E MAIS TOCADAS,"Sucesso do brasil, sucessos brasileiros, musica brasileira mais tocada, musica do brasil, musicas populares, top 50, as mais tocadas, as mais tops, musicas do momento, verao, para curtir, lançamentos, hit, Tem alguma sugestão de musica? | O que ta bombando ta aqui. Os maiores sucessos | piseiro funk",150,https://open.spotify.com/playlist/1msY3c9fzgE3V11aNhsq2O
0suNxdO0GcLUSjo5whzPQ0,Today’s Top Hits,Follow. Regularly updated,40,https://open.spotify.com/playlist/0suNxdO0GcLUSjo5whzPQ0
4q8YGq3UMDsq1Orc2cgmhM,Top 100 Classic Rock Songs of 70s 80s 90s - Greatest Classic Rock Music 70s 80s 90s Playlist,"Are you ready to rock out to the greatest classic rock hits from the 70s, 80s, and 90s? Look no further than this epic top 100 music mix! With a lineup of legendary bands and iconic songs, this mix is sure to transport you back in time and have you singing along to every classic tune. Starting off with the electrifying sound of Kiss and the timeless masterpieces of Queen, the playlist takes you on a journey through the decades, featuring the likes of Nirvana, The Police, Radiohead, and Black Sabbath.",100,https://open.spotify.com/playlist/4q8YGq3UMDsq1Orc2cgmhM
22O2eyxFVA6D2zxMhb3SUi,Modern Talking Top Tracks,"the perfect playlist for all  Modern Talking Fans: Cheri Cheri Lady, Brother Louie, You're My Heart, You're My Soul, Geronimo's Cadillac, Atlantis is Calling (S.O.S. for Love) and many more. Album: Let's Talk About Love, Back For Good, The 1st Album and more.",61,https://open.spotify.com/playlist/22O2eyxFVA6D2zxMhb3SUi
6NewzRggzRDBBPowRuXBor,1997 - Billboard Top 100,Top Hits of 1997,101,https://open.spotify.com/playlist/6NewzRggzRDBBPowRuXBor
7y4XRBNSK1DpMyvaUnFBxe,Home - Resonance (All Versions),Enjoy! Most of the songs in this playlist got taken down sadly. Will work on moving replacements &#x2F; reuploads back to the top.,382,https://open.spotify.com/playlist/7y4XRBNSK1DpMyvaUnFBxe
3U2GXg6QKbTHXaoW0vcG2A,ISRAEL TOP WAR SONGS 2023🇮🇱✡️,"the go2 playlist for israeli war songs after the massacre on the 7th of oct, updated often; Am yisrael chai🇮🇱 💪",60,https://open.spotify.com/playlist/3U2GXg6QKbTHXaoW0vcG2A
24DKKckhcPEXACdqlYTvdh,2010-2020 Top Hits (2010’s) ,"2010, 2020, 2010-2020, 2010-2020 Top Hits, 2010's, 2010s, 2010,2011,2012,2013,2014,2015,2016,2017,2018,2019,2020,2021, 2010-2015, 2010-2024, 2000s, 2000s-2010s, 2010-2020 Pop Hits - 2010 decade hits, Hits 2010, Hits 2010-2020, Top Hits (Clean Version), 2021 HITS, 2010 HITS, Radio Hits 2010-2020",129,https://open.spotify.com/playlist/24DKKckhcPEXACdqlYTvdh
64HlyiSKUzssv0uyRNQpGE,UPPERROOM: My Reward,"All of your favorites from UPPERROOM, featuring top worship songs, such as, &quot;I Thank God&quot; and &quot;Give Me Jesus.&quot; Made by <a href=""https://open.spotify.com/user/sozoofficial?si=a201aa5ac5bf4588"">SOZO Playlists</a>",203,https://open.spotify.com/playlist/64HlyiSKUzssv0uyRNQpGE
7E12DeP8o7MikBtnV7R7Sw,BACHATA & SALSA ÉXITOS 😍🛟⚓,Top 10 Mejores Salsas y Bachatas Exitos Mix Viejitas y Novedades ,87,https://open.spotify.com/playlist/7E12DeP8o7MikBtnV7R7Sw
3G5oP7ZP4gumjS25qL8KEY,Imagine Dragons - Top Hits,,30,https://open.spotify.com/playlist/3G5oP7ZP4gumjS25qL8KEY
0zLYTl823J0tneiWz62Hni,"IT WAS NEVER A PHASE, MOM",mom i&#x27;m going to hot topic with my friends can i have $20,311,https://open.spotify.com/playlist/0zLYTl823J0tneiWz62Hni
1j6IKyzEGmTN1r4rYjKuPh,SOAKING worship ,Only the top anointed super-soaker songs,114,https://open.spotify.com/playlist/1j6IKyzEGmTN1r4rYjKuPh
4xHneIit9XOLBxOvKNBev3,Harris Jayaraj Top 100 Hits | Tamil,100 Biggest Hits of Harris Jayaraj. Handpicked Hits of Harris Jayaraj. Suggestions insta id @gvsreddy.spotify,104,https://open.spotify.com/playlist/4xHneIit9XOLBxOvKNBev3
37i9dQZF1DXas7qFgKz9OV,Top Hits of 1982,"Rewind and rediscover big songs of 1984. Cover: <a href=""spotify:artist:4bthk9UfsYUYdcFyqxmSUU"">Tears For Fears</a>",100,https://open.spotify.com/playlist/37i9dQZF1DXas7qFgKz9OV
2jz4bJ8KwIVV480GNFSfk7,Z100 New York 2024 | TOP 40 | Radio Z 100 NY [Updated Weekly],Z100 NY Top 40 - Z100 United States Top 40 - Z100FM Top 40 - Z100 America - Z100 Portland - Z107.7 St.Louis - Z104.3 Baltimore - Z107 Seacoast - US Top Hits - European Hits - Radio Hits - Pop Hits - Dance Hits - Hit Music - Canada Hits - Kiss FM - Kiss Radio - Wild FM - Radio Power - Radio Hot 99.5,79,https://open.spotify.com/playlist/2jz4bJ8KwIVV480GNFSfk7
68PbMiU12ssvm5UAHsqqOi,Rap Music 2024 😈🔥💯 Top Rap Hits🐐,"BEST PLAYLIST IN THE UNIVERSE 🌍🪐☄️.   Music from Playboi Carti , Future , and The Weekend",290,https://open.spotify.com/playlist/68PbMiU12ssvm5UAHsqqOi
0mpwfhIYwjxyS5D2AgufyG,Top Tamil Hits 2024 | New Tamil Songs ,"New tamil songs from Tamil Industry, Latest Tamil.  Tamil Hits | Best Tamil Songs | New Tamil Songs | Latest Tamil Hits 2023. Best of Kollywood | Tamil songs - Vikram, G.O.A.T, Thug Life, Jailer | Thalapathy68| Anirudh | ARR | U1 |",249,https://open.spotify.com/playlist/0mpwfhIYwjxyS5D2AgufyG
3T7UPOjZRWkYkLRnMofIkX,Drum & Bass Remixes 2024 ✨ The Best DnB,Best DnB Music Remixes of Top Popular Songs &amp; Top Tiktok Songs 2024. Featuring the Most Viral Drum &amp; Bass (D&amp;B) Hits - Liquid Drum and Bass - Chill DnB - Melodic DnB - Jungle DnB - Liquid DnB,141,https://open.spotify.com/playlist/3T7UPOjZRWkYkLRnMofIkX
1jcx158Aup2NAmpUDmGDz2,2010s Throwback Hits (Top 100),Best Throwbacks from 2010 to 2015.,101,https://open.spotify.com/playlist/1jcx158Aup2NAmpUDmGDz2
0S0cuX8pnvmF7gA47Eu63M,New EDM This Week🎶New EDM 2024🎶New Dance Music🎶Top Dance Hits🎶,Updated every Friday with fresh EDM &amp; Electronic Music!,54,https://open.spotify.com/playlist/0S0cuX8pnvmF7gA47Eu63M
0I3oQjjRFzEoO0llQRlCVg,GAMING PHONK 👾,Top gaming phonk tracks - phonk for gaming - drift phonk - tiktok phonk songs,200,https://open.spotify.com/playlist/0I3oQjjRFzEoO0llQRlCVg
7eiKB8NRX5f4L6FnenQLKS,Clean Country Playlist 2024,Clean Country Music - Best country Music - Best Country Songs of All Time - Country All Time Favorites / Top Hits ,67,https://open.spotify.com/playlist/7eiKB8NRX5f4L6FnenQLKS
1WjUJZVPYJ9RtwKNeOnXmV,Top 100 Motivational Songs (GAME DAY) Sports and Workout Motivation,"Top 100 plus songs for pre game pump up. Gym, Workout, Football, soccer, running, tennis, weightlifting, basketball - every sport, every athlete needs these songs - GAME DAY Motivational playlist. Including Eminem and Eye of The Tiger.",124,https://open.spotify.com/playlist/1WjUJZVPYJ9RtwKNeOnXmV
7riPC4b2Qw8y6ogf4aq3Mi,Today's Top Rock (Chart based),,48,https://open.spotify.com/playlist/7riPC4b2Qw8y6ogf4aq3Mi
27qRA2umKyYCzqy6N2jIbJ,House Hits,Immerse yourself in the pulsating beats of our House Hits playlist. Elevate your vibe with chart-topping rhythms and infectious energy. 🏠🎶For Submissions: davidwalkerpromo@gmail.com - house - tech house - deep house - bass house - acid house - slap house,35,https://open.spotify.com/playlist/27qRA2umKyYCzqy6N2jIbJ
5SHfCXBcTIbdl0uosrEtgf,Pop Top 2024,For Submissions: popnationpromotion@gmail.com ,36,https://open.spotify.com/playlist/5SHfCXBcTIbdl0uosrEtgf
37i9dQZF1DX43B4ApmA3Ee,Top Hits of 1971,Rewind and rediscover big songs of 1971. Cover: Marvin Gaye.,100,https://open.spotify.com/playlist/37i9dQZF1DX43B4ApmA3Ee
6qv7CRaZr9nJaamM8Xtrv6,Top 50 - Russia,,50,https://open.spotify.com/playlist/6qv7CRaZr9nJaamM8Xtrv6
2mK3jEgNgQm5H58B87ZkUS,Goo Goo Dolls - Best Of ,All of the Goos top hits + &quot;Iris&quot; as heard on the Deadpool &amp; Wolverine Soundtrack!,62,https://open.spotify.com/playlist/2mK3jEgNgQm5H58B87ZkUS
37i9dQZEVXbL1Fl8vdBUba,Top Songs - Colombia,Your weekly update of the most played tracks right now - Colombia.,50,https://open.spotify.com/playlist/37i9dQZEVXbL1Fl8vdBUba
37i9dQZF1DX4dwwIoKH0j7,Top Artists of 2023 USA,The most streamed artists in the USA in 2023. Cover: Taylor Swift #SpotifyWrapped,50,https://open.spotify.com/playlist/37i9dQZF1DX4dwwIoKH0j7
37i9dQZF1DX1ahAlaaz0ZE,Hot Hits Kannada ,"Tune in to the hottest tracks of Sandalwood!
Cover : Karataka Damanaka",51,https://open.spotify.com/playlist/37i9dQZF1DX1ahAlaaz0ZE
2cThrQdD7NWH8kKJOFWKbt,"Huge Office, Work, Waiting Room Variety Mix","192+ hours of pop, top 40, classic rock, r&amp;b, yacht rock, classic soul, funk, decades 60&#x27;s 70&#x27;s 80&#x27;s 90&#x27;s and noughties, and much more! curating from 2014-present.",3137,https://open.spotify.com/playlist/2cThrQdD7NWH8kKJOFWKbt
4vBo2bq0dohHJSswn5pNGC,100 TOP HINDI OLD SONGS,,66,https://open.spotify.com/playlist/4vBo2bq0dohHJSswn5pNGC
00cyNwgfSwmnX4o7zvXIxm,AFRO HOUSE 2024 🌞 Afrohouse Hits & Remixes  (Top 100)  ,Afro House Music - Afro Remixes of Popular Songs - Best Of Afrohouse - TikTok House - Viral Music - House 2024 - Afro House Mix - Summer House - Ibiza - Lounge - Chill - Keinemusik - Mwaki  - Afro Beats - Amapiano,99,https://open.spotify.com/playlist/00cyNwgfSwmnX4o7zvXIxm
3Wu5a8j0WzMtxHGsa8vOKa,DEATH METAL TOP 100,"How about the 100 best death metal tracks ever released !!! <a href=""http://truemetalmerch.com/"">http://truemetalmerch.com</a>",100,https://open.spotify.com/playlist/3Wu5a8j0WzMtxHGsa8vOKa
7xfHMGOBCRP1WZzl5Gfqpv,Top 100 Western Songs,,98,https://open.spotify.com/playlist/7xfHMGOBCRP1WZzl5Gfqpv
37i9dQZEVXbKzoK95AbRy9,Top Songs - Brazil,Your weekly update of the most played tracks right now - Brazil.,50,https://open.spotify.com/playlist/37i9dQZEVXbKzoK95AbRy9
0Pk8kSKJ5vO5yIA36kzGMu,Kizomba Top Hits,Os hits de Kizomba 2023! Soraia Ramos Aya Nakamura Nelson Freitas Calema Djodje C4 Pedro Anselmo Ralph Loony Neyna hit romantico danca kisomba dancar love dancas amor Angola Cabo Verde Africa African Criolo Cape Dance Kizomba Dancing Kizomba Mix kizombas kisombas kizomb quizomba quisomba romantic pt,78,https://open.spotify.com/playlist/0Pk8kSKJ5vO5yIA36kzGMu
0qSZmCG0ZKBWdhZwvPYxV0,MUSICA 2024 2025😍 Noviembre 2024 🔥VERANO 2024 🕺POP LATINO 2024 🔥TOP EXITOS 2024🔥 LO MAS NUEVO,"LOS EXITOS TOP DE 2024 EN LA MEJOR LISTA | Playlist 2024 Hits | New Hits 2024| Feid, Karol G, Myke Towers, Daddy Yankee, Kapo, Taylor Swift,Trueno,Omar Courtz,Shakira, Cris Mj, Floyymenor, Billie Ellish, Bruno Mars, Lady Gaga, Bad Bunny,Bizarrap,Fuerza Regida,Diegote,Jhayco,Kapo y muchos mas.",88,https://open.spotify.com/playlist/0qSZmCG0ZKBWdhZwvPYxV0
37i9dQZEVXbLy5tBFyQvd4,Top 50 - Guatemala,Your daily update of the most played tracks right now - Guatemala.,50,https://open.spotify.com/playlist/37i9dQZEVXbLy5tBFyQvd4
1Htwf9vhCPGCblBJebQuFZ,Diomedes Diaz • Sólo Éxitos Vallenatos • Mix del Cacique ⭐️   ,Únete 💚👇 Escucha la mejor Playlist con los éxitos de Diomedes Díaz | DALE PLAY y disfruta de lo mejor del Cacique de La Junta Top Vallenato Colombia,139,https://open.spotify.com/playlist/1Htwf9vhCPGCblBJebQuFZ
7M3lwAY5fVpXQX84RjCt2h,Jesea Lee's Top 10 Trending Tracks (The Distorted 10),"A weekly countdown of the top 10 songs in the alternative music scene. Like TRL, but for pop punk, emo, metalcore, etc. Playlist also includes other songs in my personal rotation this week. TikTok&#x2F;IG @jesealee",169,https://open.spotify.com/playlist/7M3lwAY5fVpXQX84RjCt2h
37i9dQZEVXbJZGli0rRP3r,Top Songs - South Korea,Your weekly update of the most played tracks right now - South Korea.,50,https://open.spotify.com/playlist/37i9dQZEVXbJZGli0rRP3r
5wbHH4DqF4AVuGmjXI8kcW,1981 - Billboard Top 100,"Missing Songs: #82 - &quot;It&#x27;s Now Or Never&quot; by John Schneider,  #93 - &quot;The Beach Boys Medley&quot; by The Beach Boys",99,https://open.spotify.com/playlist/5wbHH4DqF4AVuGmjXI8kcW
