Playlist ID,Nombre Playlist,Descripción,Número de canciones,Url de Spotify
37i9dQZEVXbMDoHDwVN2tF,Top 50 - Global,Your daily update of the most played tracks right now - Global.,50,https://open.spotify.com/playlist/37i9dQZEVXbMDoHDwVN2tF
37i9dQZF1DXcBWIGoYBM5M,Today’s Top Hits,The hottest 50. Cover: Lady Gaga,50,https://open.spotify.com/playlist/37i9dQZF1DXcBWIGoYBM5M
37i9dQZEVXbLRQDuF5jeBp,Top 50 - USA,Your daily update of the most played tracks right now - USA.,50,https://open.spotify.com/playlist/37i9dQZEVXbLRQDuF5jeBp
37i9dQZF1DX1lVhptIYRda,Hot Country,Today's top country hits. Cover: Cody Johnson,50,https://open.spotify.com/playlist/37i9dQZF1DX1lVhptIYRda
37i9dQZF1Fa1IIVtEpGUcU,Your Top Songs 2023,Spotify Wrapped presents the songs you loved this year,0,https://open.spotify.com/playlist/37i9dQZF1Fa1IIVtEpGUcU
37i9dQZEVXbO3qyFxbkOE1,Top 50 - Mexico,Your daily update of the most played tracks right now - Mexico.,50,https://open.spotify.com/playlist/37i9dQZEVXbO3qyFxbkOE1
37i9dQZF1DX10zKzsJ2jva,Viva Latino,"Today's top Latin hits, elevando nuestra música. Cover: Duki",50,https://open.spotify.com/playlist/37i9dQZF1DX10zKzsJ2jva
7nNBIhkf6NcdwOG0yJ7oI3,Top Gun Maverick Soundtrack,"Best songs and music from Top Gun 2022. <a href=""https://open.spotify.com/user/31s767o2yihq7nwu5lvbqjvydqru/playlist/2jPMmXPiDhthMYEbYjVRNf"">Click here for the 1986 movie Soundtrack.</a>",24,https://open.spotify.com/playlist/7nNBIhkf6NcdwOG0yJ7oI3
37i9dQZF1DX0kbJZpiYdZl,Hot Hits USA,The hottest tracks in the United States. Cover: Bruno Mars & ROSÉ,50,https://open.spotify.com/playlist/37i9dQZF1DX0kbJZpiYdZl
5ABHKGoOzxkaa28ttQV9sE,Top 100 most streamed songs on Spotify *Updated*,"The 100 most streamed songs on Spotify ever, in correct order (last updated November 4th 2024)",100,https://open.spotify.com/playlist/5ABHKGoOzxkaa28ttQV9sE
0X4qRSrI7W6r3HR87ei5iS,TopChicksRadio,party classics if you feeling white girl💋,195,https://open.spotify.com/playlist/0X4qRSrI7W6r3HR87ei5iS
37i9dQZF1DX7aUUBCKwo4Y,Country Top 50,Country music's 50 most played songs in the world. Updated weekly. Cover: Post Malone and Morgan Wallen,50,https://open.spotify.com/playlist/37i9dQZF1DX7aUUBCKwo4Y
2jPMmXPiDhthMYEbYjVRNf,Top Gun Soundtrack (1986),"Top Gun 1 Soundtrack with Danger Zone, Take my Breath Away, Top Gun Anthem...",16,https://open.spotify.com/playlist/2jPMmXPiDhthMYEbYjVRNf
46iQn1DHoYNlHwBIOnfAxi,Top 100 Nigeria on Apple Music,"Top 100 Nigeria Afrobeats  updated daily.  Fi Kan We Kan Bnxn Rema • Alone FOLA • Awolowo  Fido •  MMS Asake •  Higher Burna Boy • JUJU  ODUMODUBLVCK, Shallipopi, Smur Lee • Murhaba Kizz Daniel • Favourite Girl Rema • Abanikanda  Zinoleesky • Awuke Davido • Piece of my Heart WizKid Order Shallipopi",100,https://open.spotify.com/playlist/46iQn1DHoYNlHwBIOnfAxi
19PgP2QSGPcm6Ve8VhbtpG,80s HITS | TOP 100 SONGS ,"The best of the 1980s classics from Michael Jackson, Journey, Whitney Houston, TOTO, AC/DC, Kenny Loggins, Billy Joel, Survivor + more. Stranger Things, Top Gun, Back to the Future.",125,https://open.spotify.com/playlist/19PgP2QSGPcm6Ve8VhbtpG
5KJDMJe9EJ7QRz8FG2MIpI,BEST HITS 2024 🔥 Popular Songs 🎵 Top Music Hits 🎵 ,Best Hits 2024 | Popular Songs 2024 | Top Music Hits | Today Top Hits | Viral Hits | Radio Hits 2023/2024 | Summer Music Mix 2024 | Best Of 2024 | Summer Vibes | Deep House | Pop Vibes | Top Songs | Top Music | Global Hits | Best Songs| Clean | Pop Hits | Viral Pop - updated and active! :),145,https://open.spotify.com/playlist/5KJDMJe9EJ7QRz8FG2MIpI
6UeSakyzhiEt4NB3UAd6NQ,Billboard Hot 100,"The official <a href=""http://www.billboard.com/charts/hot-100"">Billboard Hot 100</a> features this week's most popular songs across all genres, ranked by radio airplay monitored by Nielsen BDS, download sales tracked by Nielsen SoundScan and streaming activity data provided by leading online music services. For more information go to <a href=""http://Billboard.com"">Billboard.com</a>.",100,https://open.spotify.com/playlist/6UeSakyzhiEt4NB3UAd6NQ
6XMhvUe2OfARE6iEjhx96k,Lullabies for Baby Sleep 2024 💤 🧸😴,"The Top 100 Soothing Hand-Picked Piano Lullaby Melodies - Cool, Calm and gentle lullabies to help rock your baby to sleep - Includes Twinkle, Twinkle Little Star, Tiny Dancer, I See The Moon, A Million Dreams, Disney, Pop, Classical &amp; many more. (Little Rainbow Playlists 2024) - Updated Sept 2024",100,https://open.spotify.com/playlist/6XMhvUe2OfARE6iEjhx96k
5Ux99VLE8cG7W656CjR2si,TOP CHRISTIAN HITS 2024,"Popular Christian music November 2024! Top Christian Mix, Christian Radio Hits, Top Hits, and Worship Now. Updated frequently! Top artists include Lauren Daigle, Bethel Music, Carrie Underwood, Hillsong Worship, Kari Jobe, Natalie Grant, Elevation Worship, Crowder, Tauren Wells, Chris Tomlin &amp;more!",1001,https://open.spotify.com/playlist/5Ux99VLE8cG7W656CjR2si
37i9dQZF1E4x9kylcU4jOX,Zach Top Radio,"With Treaty Oak Revival, Braxton Keith, Gavin Adcock and more",50,https://open.spotify.com/playlist/37i9dQZF1E4x9kylcU4jOX
1udqwx26htiKljZx4HwVxs,2000s Throwbacks (Top 100 Hits),Best Throwback Hits from 2000 to 2010 with a few older and more recent picks.,112,https://open.spotify.com/playlist/1udqwx26htiKljZx4HwVxs
3C64V048fGyQfCjmu9TIGA,90s HITS | TOP 100 SONGS,"The best of the 1990s classics, from TLC, Backstreet Boys, Destiny's Child, *NSYNC, Mariah Carey, Christina Aguilera, Britney Spears, Jennifer Lopez + more.",147,https://open.spotify.com/playlist/3C64V048fGyQfCjmu9TIGA
774kUuKDzLa8ieaSmi8IfS,Top Hits of 2024,Spotify presents... Top Hits of 2024! Cover: Sabrina Carpenter ,100,https://open.spotify.com/playlist/774kUuKDzLa8ieaSmi8IfS
30wdzfOKmW7JmLPiQI0BGC,Top Christian Worship Songs,,127,https://open.spotify.com/playlist/30wdzfOKmW7JmLPiQI0BGC
0Hm1tCeFv45CJkNeIAtrfF,Top 100 Artists (Monthly Listenership),A list of the top 100 artists on Spotify based on monthly listenership. Last updated: 5 November 2024,100,https://open.spotify.com/playlist/0Hm1tCeFv45CJkNeIAtrfF
37i9dQZF1DXdpy4ZQQMZKm,Top Throwbacks 2023,The songs with the biggest throwback moments. Cover: Arctic Monkeys,100,https://open.spotify.com/playlist/37i9dQZF1DXdpy4ZQQMZKm
37i9dQZF1DWTyiBJ6yEqeu,Top Gaming Tracks,"Press play, press start.",100,https://open.spotify.com/playlist/37i9dQZF1DWTyiBJ6yEqeu
37i9dQZF1EIVmfv49yD6KE,Zach Top Mix,"<a href=spotify:playlist:37i9dQZF1EIYYY5Umuciag>Braxton Keith</a>, <a href=spotify:playlist:37i9dQZF1EIXiPF44bLd7s>Treaty Oak Revival</a> and <a href=spotify:playlist:37i9dQZF1EIUVSaKpNVAyD>Gavin Adcock</a>",50,https://open.spotify.com/playlist/37i9dQZF1EIVmfv49yD6KE
1frm0Bimtfci8wl3hKvMtF,Top Gun : Maverick (2022) - Original Soundtrack,Best original songs and music from and inspired by the 2022 movie soundtrack composed by Harold Faltermeyer &amp; Hans Zimmer including &quot;Hold My Hand&quot; by Lady Gaga.  Go Maverick!,54,https://open.spotify.com/playlist/1frm0Bimtfci8wl3hKvMtF
5KmBulox9POMt9hOt3VV1x,70s HITS | TOP 100 SONGS,"The best of the 1970s classics, from &quot;September&quot; Earth Wind &amp; Fire, AC/DC, Michael Jackson, Bruce Springsteen, Hall &amp; Oates, Billy Joel, Paul Simon, Bill Withers &amp; more!",138,https://open.spotify.com/playlist/5KmBulox9POMt9hOt3VV1x
67By0TFyhmb4jKal8eXHHT,Country TOP 40 2024 - Top Country Songs This Week 2024,Find our playlist with these keywords: best country music 2024 - popular country songs 2024 - country top 40 - top country hits 2024 - most listened country songs 2024 - famous country music 2024 - top country songs this week - today&#x27;s country 2024 - current country hits 2024 - country mix 2024,40,https://open.spotify.com/playlist/67By0TFyhmb4jKal8eXHHT
1KRZH6WH8qYgaVnagjjOFV,Top Christian Hits 2024,"Top Christian Hits 2024 | Latest and greatest Christian songs of 2024. Made by <a href=""spotify:user:sozoofficial"">SOZO Playlists</a>. Cover: <a href=""https://open.spotify.com/artist/3SKza3YPBri1k43LB1Tqy4?si=JwGjVmx0QCuJb6ekGfF19g"">Tauren Wells</a>",145,https://open.spotify.com/playlist/1KRZH6WH8qYgaVnagjjOFV
37i9dQZEVXbNxXF4SkHj9F,Top 50 - South Korea,Your daily update of the most played tracks right now - South Korea.,50,https://open.spotify.com/playlist/37i9dQZEVXbNxXF4SkHj9F
3FSvK3GkiECDMHeeIbbJIn,COUNTRY MUSIC 2024 🔥 Top Country Hits + New Country Songs,best country songs of 2024 most popular trending today modern mix viral top 100 hottest contemporary country pop rock latest americana,157,https://open.spotify.com/playlist/3FSvK3GkiECDMHeeIbbJIn
6swljWWKimZ6x8CtS7e8uc,Top 100 Nigeria,"Afrobeat  Biggest Hit Songs, Afrobeat Trending Songs, + New songs from your favorite Artistes  •Updated Daily•",146,https://open.spotify.com/playlist/6swljWWKimZ6x8CtS7e8uc
37i9dQZF1DXaJXCbmtHVHV,Big Country,Top country hits you know and love! Cover: Bailey Zimmerman,100,https://open.spotify.com/playlist/37i9dQZF1DXaJXCbmtHVHV
6qd48xm5P7JXCxSdIQe4Ur,Billboard Top 40 (November 2024),Tracking the Billboard Top 40 hits for the month of October according to Billboard.com. The playlist is updated every Tuesday to reflect changing chart positions.,106,https://open.spotify.com/playlist/6qd48xm5P7JXCxSdIQe4Ur
37i9dQZEVXbKXQ4mDTEBXq,Top 50 - Japan,Your daily update of the most played tracks right now - Japan.,50,https://open.spotify.com/playlist/37i9dQZEVXbKXQ4mDTEBXq
37i9dQZF1DWUileP28ODwg,Top Christian Contemporary,"Tune in here for new and current hits in Contemporary Christian music! Cover: <a href=""spotify:artist:5X77nNxT45eR0OshjmAvKa"">Mac Powell</a>",75,https://open.spotify.com/playlist/37i9dQZF1DWUileP28ODwg
37i9dQZEVXbOa2lmxNORXQ,Top 50 - Colombia,Your daily update of the most played tracks right now - Colombia.,50,https://open.spotify.com/playlist/37i9dQZEVXbOa2lmxNORXQ
37i9dQZF1DXcb6CQIjdqKy,Top Christian & Gospel,"The best mix of today's Christian music, all genres, worldwide. Cover: <a href=""spotify:artist:40LHVA5BTQp9RxHOQ9JPYj"">Lauren Daigle</a>",101,https://open.spotify.com/playlist/37i9dQZF1DXcb6CQIjdqKy
37i9dQZEVXbNFJfN1Vw8d9,Top 50 - Spain,Your daily update of the most played tracks right now - Spain.,50,https://open.spotify.com/playlist/37i9dQZEVXbNFJfN1Vw8d9
1ti3v0lLrJ4KhSTuxt4loZ,Top Classic Rock Hits Of All Time,,708,https://open.spotify.com/playlist/1ti3v0lLrJ4KhSTuxt4loZ
5KLKS1zjjeqSe6oRgsdUMb,MEXICO Top 100 🇲🇽 (actualizada cada semana) ,La música que está marcando tendencia y va a romper en Mexico curada por Diskover. Latin Reggaeton Pop Trap Latino Rock Alternativo. Duki Khea Paulo Londra Lenny Tavarez Ysy A Sofia Reyes Bad Bunny J Balvin Daddy Yankee Becky G Ozuna Romeo Santos Aitana Sebastian Yatra Maluma Noriel Reik Nio Garcia ,100,https://open.spotify.com/playlist/5KLKS1zjjeqSe6oRgsdUMb
37i9dQZF1DWW7RgkOJG32Y,Breakout Country,Top trending country tracks from the last few months. Cover: Waylon Wyatt and Bayker Blankenship,55,https://open.spotify.com/playlist/37i9dQZF1DWW7RgkOJG32Y
0wFL1lMU8TN3blKQKNWmeD,Top 40 Songs This Week 2024, Top 40 Songs This Week 2024,40,https://open.spotify.com/playlist/0wFL1lMU8TN3blKQKNWmeD
37i9dQZEVXbLp5XoPON0wI,Top Songs - USA,Your weekly update of the most played tracks right now - USA.,50,https://open.spotify.com/playlist/37i9dQZEVXbLp5XoPON0wI
4joqw3e0n9gDNVDhgKapCU,TOP 10 Songs of the Week 2024 - Today's 10 Music Hits 2024,Find our playlist with these keywords: top songs 2024 - hits 2024 - weekly music 2024 - top 10 music 2024 - best songs 2024 - trending music 2024 - today&#x27;s hits 2024 - popular songs 2024 - music hits this week - 2024 music playlist - weekly top 10 2024 - today&#x27;s music 2024 - best of the week 2024,100,https://open.spotify.com/playlist/4joqw3e0n9gDNVDhgKapCU
3DYUw0nHB9o8tLZKQup4zp,Classic Rock #1 Hits,"Top Classic Rock Hits of All Time, Greatest Classic rock songs of all time,  Top 100 Most Popular rock Songs, Gym Rock, Rock n Roll Greatest Hits",172,https://open.spotify.com/playlist/3DYUw0nHB9o8tLZKQup4zp
1EVE9kOZ2i4171hNdvWVhU,TOP 100 Songs of 2024 (Best Hit Music Playlist),Find our playlist with these keywords: top 100 songs - top songs of 2024 - popular 100 songs - top music mix 2024 - good songs 2024 - top 100 music 2024 - hot 100 songs 2024 - music mix 2024 - top 100 most popular songs 2024 - hit music playlist 2024 - best of 2024 songs - top 100 songs of 2024,100,https://open.spotify.com/playlist/1EVE9kOZ2i4171hNdvWVhU
4liDm4FUbLZKkN7hmwBB0x,Top 20 Global artistas. Most monthly listeners,"(30) Ranking Oyentes Mensuales en Spotify Charts. Bruno Mars, The Weeknd, Lady Gaga, Billie Eilish, Coldplay, Taylor Swift, Rihanna, Ariana Grande, Justin Bieber, Sabrina Carpenter",31,https://open.spotify.com/playlist/4liDm4FUbLZKkN7hmwBB0x
0NvTo731cP2l4wYwGFzdQ0,Clean HITS 2024 🍊 Best Pop Clean Songs 2024 Hits,"Best Clean Pop Hits 2024 and Top clean songs 2024. Clean songs to play safe. No explicit music, just clean songs and clean versions of top hits 2023 + 2024 and more. ",306,https://open.spotify.com/playlist/0NvTo731cP2l4wYwGFzdQ0
03sDEv7FN58Mb9CJOs1Tgn,Reggaeton 2024 😍 🔥,Today&#x27;s Top Latin Urban Music Of The Year 2024!#Reggaeton,153,https://open.spotify.com/playlist/03sDEv7FN58Mb9CJOs1Tgn
37i9dQZEVXbLnolsZ8PSNw,Top 50 - United Kingdom,Your daily update of the most played tracks right now - United Kingdom.,50,https://open.spotify.com/playlist/37i9dQZEVXbLnolsZ8PSNw
4vPChLRJ1l7KV0YAgjGyRD,Gaming Music - Top 2024 Gaming Tracks  🎮🎮,Check out the new Myles Smith Concert created in Fortnite. You can listen to Myles' hit songs here! Island Code: 0444-1297-2061,353,https://open.spotify.com/playlist/4vPChLRJ1l7KV0YAgjGyRD
37i9dQZEVXbMXbN3EUUhlg,Top 50 - Brazil,Your daily update of the most played tracks right now - Brazil.,50,https://open.spotify.com/playlist/37i9dQZEVXbMXbN3EUUhlg
2e3dcRuo9uDH6qD3NOGKAL,EDM Music 2024 (Top 100),Electronic Dance Music Playlist with the best new hits from 2021 and a few throwbacks from 2000s - 2020.,126,https://open.spotify.com/playlist/2e3dcRuo9uDH6qD3NOGKAL
5wxbjKllizUAAytzphzclp,Top Country Hits Of All Time,,132,https://open.spotify.com/playlist/5wxbjKllizUAAytzphzclp
01MRi9jFGeSEEttKOk7VgR,All Time Rap Bangers 2010-2024,Rap Bangers - Best Rap Hits - Top Rap Songs - Best Hip Hop Songs - Viral Hip Hop - Viral Rap Hits - Trap Rap Playlist - Hottest Hip Hop Bangers - Hottest Rap Hits - Frat Party Rap - Lit Party - Aux Bangers - Hardest Rap Songs,287,https://open.spotify.com/playlist/01MRi9jFGeSEEttKOk7VgR
7E3uEa1emOcbZJuB8sFXeK,top hits 2000-2024,top hits 2000-2024 - throwbacks - classics; New hits; Music hits ; chart toppers ; greatest hits ; top tracks ; tophits,356,https://open.spotify.com/playlist/7E3uEa1emOcbZJuB8sFXeK
5mMwgU3jW7Wxxkr5F7GzSj,YACHT ROCK | TOP 100 SONGS,"70s + 80s Soft Rock for a day on the boat. Island tunes, chill summer hits + smooth sailing while jamming to hits from Earth, Wind &amp; Fire, TOTO, Looking Glass, Billy Joel, Hall &amp; Oates + more.",153,https://open.spotify.com/playlist/5mMwgU3jW7Wxxkr5F7GzSj
6i2Qd6OpeRBAzxfscNXeWp,Top 100 Greatest Songs of All Time,Top 100 Greatest Songs of All Time,116,https://open.spotify.com/playlist/6i2Qd6OpeRBAzxfscNXeWp
2EoheVFjqIxgJMb8VnDRtZ,BEST KPOP 2024 - TOP HITS,The best K-pop songs of 2024 | contact IG @nbe3awe,202,https://open.spotify.com/playlist/2EoheVFjqIxgJMb8VnDRtZ
71R43lBYQZ6JQXH6LmRo1I,Reggae Classics 70s 80s & 90s | The Best Reggae Songs Of All Time | Reggae Music Hits | Top Reggae,Enjoy the best reggae songs of all time! (Curta as melhores músicas de reggae de todos os tempos.Foto: #BobMarley &amp;#x2F;Foto Grátis Fonte:Pixabay) #ReggaeClassics #TheBestReggaeSongsAllTime #TopReggae  #UB40 #GregoryIsaacs #ZiggyMarley #Sublime #PeterTosh #BarringtonLevy #Shaggy #AlphaBlondy #TheWai,84,https://open.spotify.com/playlist/71R43lBYQZ6JQXH6LmRo1I
7xY8wHHjF0wxke2dkK3sRc,90's Alternative Rock (Top 100),The top 100 alternative rock songs on Spotify from 1990-1999.,114,https://open.spotify.com/playlist/7xY8wHHjF0wxke2dkK3sRc
4SmdD93OBITL4faOn2Wa3B,AVENTURA MEJORES EXITOS 🎶😘,TOP 10,40,https://open.spotify.com/playlist/4SmdD93OBITL4faOn2Wa3B
3U7F6ooo6JEJH9a8c36rU9,Worship Music 2024,"THE playlist for the top Christian and Worship hits of 2024!  featuring Maverick City, Forrest Frank, Charity Gayle, Elevation Worship, Phil Wickham, Cody Carnes, Brook Ligertwood, and more!",140,https://open.spotify.com/playlist/3U7F6ooo6JEJH9a8c36rU9
4h9dvquufDVDyGuYRHeu73,2000 R&B Hits - Top R&B 2000s Songs (R&B 00s Popular Songs),Find our playlist with these keywords: 2000 r&amp;b songs - best r&amp;b 2000s - r&amp;b hits 2000 - top r&amp;b song 2000 - 2000s r&amp;b hits - r&amp;b 00s songs - 00s r&amp;b top - r&amp;b 2000 playlist - popular r&amp;b 2000s - top r&amp;b songs 2000 - 2000 r&amp;b music - best of 2000 r&amp;b - 2000s r&amp;b jams - r&amp;b songs from 2000,150,https://open.spotify.com/playlist/4h9dvquufDVDyGuYRHeu73
25Y75ozl2aI0NylFToefO5,Afrobeats Hits 🔥,"All the old and New Hits in one playlist. Best Afrobeats, Afrobeats Hits, African music, Top Afrobeats 2024, Afrobeat 2024, Top 100 Nigeria - Rema - Tyla - Ayra Starr - Oxlade - Wizkid - Burna Boy - Davido - Omah Lay - FireboyDML - Tems - Lojay -Libianca - Asake - Adekunle  - City Boys - Peru.",120,https://open.spotify.com/playlist/25Y75ozl2aI0NylFToefO5
37i9dQZEVXbNG2KDcFcKOF,Top Songs - Global,Your weekly update of the most played tracks right now - Global.,50,https://open.spotify.com/playlist/37i9dQZEVXbNG2KDcFcKOF
5XALIurWS8TuF6kk8bj438,Top Hits of the 2010s,,500,https://open.spotify.com/playlist/5XALIurWS8TuF6kk8bj438
3ba6w8ldKCmJN8IxI8ClXm,Bollywood Party 2024 🔥,Top Bollywood Hits of the Year | ig: _ashvipatel,374,https://open.spotify.com/playlist/3ba6w8ldKCmJN8IxI8ClXm
487jKTFqWhs6b0AEUz0WpX,Afro House 2024 🌴 (Top 100) ,"Oxygen for Afro House lovers │<a href=""https://www.instagram.com/weareuncommonrecords/"">Instagram</a>",102,https://open.spotify.com/playlist/487jKTFqWhs6b0AEUz0WpX
37i9dQZF1DWXVJK4aT7pmk,Hot Hits Punjabi,Catch the hottest Punjabi tracks. Cover - Gurnazar,75,https://open.spotify.com/playlist/37i9dQZF1DWXVJK4aT7pmk
37i9dQZF1DWUrIr0kH1BCb,Best of Sesame Street,"The top hits from your friends on <a href=""spotify:artist:50bY8HGxT0SuDgJX3AilTT"">Sesame Street</a>.",41,https://open.spotify.com/playlist/37i9dQZF1DWUrIr0kH1BCb
0dMexqq0XIWS3QJ74z3ZhD,Hip Hop 2000s Music - Best Hip Hop Hits of the 00s Playlist (Top Hip Hop Songs from 2000 to 2009),Find our playlist with these keywords: best 2000s hip hop music - 2000s hip hop music - 2000 hip hop - 00 hip hop songs - hip hop music video 2000s - 2000s hip hop hits - 2000s hip hop - hip hop 2000s - hip hop music mix 2000s - hip hop music video mix 2000s - best 2000s hip hop - 00s hip hop mix,150,https://open.spotify.com/playlist/0dMexqq0XIWS3QJ74z3ZhD
1kMyrcNKPws587cSAOjyDP,90s R&B Hits (Top 100),"Best 90s RnB playlist with the classic old Hits, Love Songs and some Old School Hip Hop and Soul.",126,https://open.spotify.com/playlist/1kMyrcNKPws587cSAOjyDP
37i9dQZF1DWTcqUzwhNmKv,Kickass Metal,Ice Nine Kills on top of today's best Metal playlist.,75,https://open.spotify.com/playlist/37i9dQZF1DWTcqUzwhNmKv
5l6rFyXN63iINVsbaBObag,Christmas Music 🎄 Top Classic Songs,Christmas Songs | Classic Christmas | Christmas Classics | Xmas | Vintage Christmas | Holiday Music | Best Christmas | Pasko | Holiday Songs | All I Want For Christmas Is You | Rockin Around The Christmas Tree | Last Christmas | Let It Snow | Sleigh Ride | It's The Most Wonderful Time of the Year,168,https://open.spotify.com/playlist/5l6rFyXN63iINVsbaBObag
4uf0gphPVNtk4Uu0bxtdGA,Acoustic Covers 2024 (Top 100),Best acoustic guitar and piano hits and cover of 2019 - 2023 + a few oldies. unplugged_rec on IG.,102,https://open.spotify.com/playlist/4uf0gphPVNtk4Uu0bxtdGA
37i9dQZF1DZ06evO2JPFuy,This Is Zach Top,"This is Zach Top. The essential tracks, all in one playlist.",50,https://open.spotify.com/playlist/37i9dQZF1DZ06evO2JPFuy
1ZnzJ3CHzRhF9InzmdOj3v,BACHATAS VIEJAS PERO BUENAS💝😘,"Grandes Éxitos de la Mejor Bachata &#x2F; Top las Mejores Canciones Románticas de Bachata, Bachata Mix,  Bachatas Viejas &amp; Nuevas, Bachata Antigua &amp; Moderna, Bachata Sensual para Bailar, La Bachata Éxitos",40,https://open.spotify.com/playlist/1ZnzJ3CHzRhF9InzmdOj3v
0VlnINr5zjWZKubD4ePmD9,Top Eminem hits of all time 🔥,,54,https://open.spotify.com/playlist/0VlnINr5zjWZKubD4ePmD9
6bylhv1iSmMylVzgeWTtkb,HOUSE MIX 2024 🔥 HOUSE PARTY 2024 🔥HOUSE MUSIC 2024 🔥,HOUSE MIX 2024 🔥 HOUSE PARTY 2024 🔥DANCE &amp; CLUB MIX 2024 | BEST HOUSE MIX | REMIXES POPULAR SONGS | BEST FOR YOUR PARTY | TOP MUSICA | TECHNO PARTY | TECHNO FUN | CLUB TECHNO | HOUSE MUSIC 2024 | TEKNO 2024 | BEST HOUSE | AFRO HOUSE 2024 | TOP PARTY MIX | HOUSE HITS 2024 | SUMMER HOUSE | BEACH HOUSE,118,https://open.spotify.com/playlist/6bylhv1iSmMylVzgeWTtkb
51lDLEyXP4SU1HQAEH2YCz,Top 2000s- 2010s hits clean,,278,https://open.spotify.com/playlist/51lDLEyXP4SU1HQAEH2YCz
4canQPWF4l6OdGq6fq94WM,Top 100 Running Songs,songs to listen to while on a run,238,https://open.spotify.com/playlist/4canQPWF4l6OdGq6fq94WM
1CKZs4Atk5gBaL40EUVZRg,Nursery Rhymes for Children 2024 😀🐻🦆🙈,"The Top 100 Nursery Rhymes for Kids. Move, groove, and sing along to the best nursery rhyme songs ever! (Little Rainbow Playlists 2024)",100,https://open.spotify.com/playlist/1CKZs4Atk5gBaL40EUVZRg
37i9dQZF1DX4KeocBrdbJg,Hits de Internet,te tqm Moo Deng ✨,91,https://open.spotify.com/playlist/37i9dQZF1DX4KeocBrdbJg
0y0ZEQHqEdMPnQKqRKhSmn,Greatest 90s Music Hits - Best Songs of 1990 to 2000,Find our playlist with these keywords: greatest 90s music - top songs of 1990 to 2000 - 90s music greatest hits playlist - most known 90s songs - most famous 90&#x27;s songs - songs 90s to 2000 - songs from 1990 to 2000 - top 90s hit songs - most popular 90s songs playlist - 90s music mix,150,https://open.spotify.com/playlist/0y0ZEQHqEdMPnQKqRKhSmn
71v6svMIbeEIX1EJ3gYZ8i,🇲🇽TOP REGIONAL MEXICANO 2024 🔥 ,Lo mejor del 2024 lo más nuevo del regional mexicano,73,https://open.spotify.com/playlist/71v6svMIbeEIX1EJ3gYZ8i
6LYS2WSk5Rtix5JH1LqIeu,Zach Top — all songs,,34,https://open.spotify.com/playlist/6LYS2WSk5Rtix5JH1LqIeu
6QVY4ER4zZC6NJUYwVT2XT,THE BEST KIDZ BOP KIDS SONGS EVER!!!!!!!!!!,Listen to some of the top kidz bop kids songs! They are the top hits sung by kids for kids that are kid friendly! I will be adding new music too! I worked hard on this playlist. Hope you love it!,167,https://open.spotify.com/playlist/6QVY4ER4zZC6NJUYwVT2XT
7bu7BZEusLNJSaAuUUZBKn,House Music 2024 (Top 100),"Discover the best House Music to vibe or dance to.│<a href=""https://www.instagram.com/weareuncommonrecords/"">Instagram</a>",100,https://open.spotify.com/playlist/7bu7BZEusLNJSaAuUUZBKn
0znR1ROsHpKqsFT1c55Yzu,Golden Oldies 50's & 60's - Best of 50s/60s. EN Greatest hits - Grandes éxitos de  los años 50 y 60.,Top 500 Golden Oldies Songs Of All Time. 50s and 60s Music Hits. La mejor música de todos los tiempos en inglés. Listen to the playlist of the 80s and more...,505,https://open.spotify.com/playlist/0znR1ROsHpKqsFT1c55Yzu
2AIyLES2xJfPa6EOxmKySl,100 of the most famous classical music pieces 🎻 🎹 🎺,"Top 100 classical music masterpieces everyone knows, but not everybody knows their titles. Includes Mozart, Beethoven, Chopin, Rossini, Tchaikovsky, Strauss, Delibes, Bizet, Bach, Vivaldi, Offenbach, Brahms, Debussy, Handel, Bedrich and Mussorgsky...",102,https://open.spotify.com/playlist/2AIyLES2xJfPa6EOxmKySl
4iRJJqX3W4u5CRqoQbWmqY,BEST stand up comedy on Spotify (200+ hours),"2500+ top standup comedy tracks from louis ck, john mulaney, shane gillis. tom segura, theo von,  patton oswalt, jim gaffigan, andrew santino, mark normand, mike birbiglia,  george carlin, bill hicks, bill burr, Joe Rogan, and more",5091,https://open.spotify.com/playlist/4iRJJqX3W4u5CRqoQbWmqY
69sctJ0acuqqO1dAjcSdBj,80's Country (Top 100),The top 100 country songs on from 1980-1989.,119,https://open.spotify.com/playlist/69sctJ0acuqqO1dAjcSdBj
1DbclUIElPHlguDpZW7IAB,K LOVE 2024,"The Best Christian Songs from Top Christian Radio Stations and Worship Radio Stations K Love, Air 1, Way FM, The Fish, Air1, KLove, Spirit FM, The Message, WGTS 91.9, Smile FM, and more! All to help you worship God throughout the day!🙏🏻🙏🏼🙏🏽🙏🏾🙏🏿",76,https://open.spotify.com/playlist/1DbclUIElPHlguDpZW7IAB
1YA5cPIfDy3L03bGnNiDM7,Anime Openings (Top 100),"Best Anime OST, Songs, Music Opening &amp; Ending with Tokyo Ghoul, Death Note, Full Metal, Naruto... Top OP | Musica | Japanese, Los mejores. Also inc a few gaming picks.",129,https://open.spotify.com/playlist/1YA5cPIfDy3L03bGnNiDM7
37i9dQZF1DX45xYefy6tIi,ESPN Top Plays,Jelly Roll and ESPN team up for a playlist celebrating “The Greatest Story Ever Played” as the hunt to crown a National Champion begins. ,89,https://open.spotify.com/playlist/37i9dQZF1DX45xYefy6tIi
37i9dQZF1E4lFtvse7dRNN,ZZ Top Radio,"With Lynyrd Skynyrd, Van Halen, Led Zeppelin and more",50,https://open.spotify.com/playlist/37i9dQZF1E4lFtvse7dRNN
5iwkYfnHAGMEFLiHFFGnP4,HITS 2024 - Today's Top Songs,HITS 2024 🔥 All of today's top chart hits and hot new releases from around the world. Hit ♡ to hear the biggest new songs first! Cover: ROSÉ &amp; Bruno Mars,64,https://open.spotify.com/playlist/5iwkYfnHAGMEFLiHFFGnP4
32HovauslOCYTENgeZlk6M,AFROBEATS TOP 100 🔥🔥🔥(AFRICAN HEAT |AFROBEATS MUSIC |NAIJA |AFROPOP | WIZKID | BURNA | TYLA | REMA,"🙏🙏🙏AFROBEATS ALL TIME HITS ONLY!!! Feat. Burna Boy, Wizkid, Davido, Tems, CKay, Omah Lay, JoeBoy, Tiwa Savage, Yemi Alade, Drake, Tekno, Mr Eazi, P-Square, RunTown, Sarkodie, Kuami Eugene, Kidi, Aya Nakamura, Fuse ODG, Major Lazer, Olamide, Diamond Planumz, Ed Sheeran, Justin Bieber",101,https://open.spotify.com/playlist/32HovauslOCYTENgeZlk6M
